Key	Company	Position	Location	Category	Experience_Level	Salary
a086f25bde066103	Group W	Operations Research Analyst/Data Scientist (Mid to Senior Level)	Tampa, FL 33621 (MacDill AFB area)	DA	SENIOR_LEVEL	$110,000 - $120,000 a year
36c22423d3aa9091	Berkley	Business Analyst	Urbandale, IA 50322	DA	SENIOR_LEVEL	Estimated $75.5K - $95.6K a year
1fcef8f6e405c83b	Duke University	IT Analyst Sr - Application Delivery Business Analyst	Durham, NC 27710 (Duke West Campus area)	DA	SENIOR_LEVEL	Estimated $81.7K - $103K a year
8712e1d6d4a522b7	Metasys Technologies	Business Analyst	Oakland, CA 94603 (Coliseum Industrial area)	DA	SENIOR_LEVEL	
95130171f2c9f856	Quest Global	Sr. Data Analyst	Rockford, IL	DA	SENIOR_LEVEL	Estimated $99.9K - $126K a year
36e4ae60f386f5c9	Cox powered by Atrium	Business Analyst (2023-6865)	Atlanta, GA	DA	SENIOR_LEVEL	$52 - $57 an hour
c7b99e58154294c2	Davies US LLC	Senior Business Analyst	Remote in United States	DA	SENIOR_LEVEL	$85,000 - $105,000 a year
92be07e6513ea783	CACI	Business Analyst	Ashburn, VA 20147	DA	SENIOR_LEVEL	
1e0728ded250ebb9	OneGlobe LLC	Business Analyst	Hybrid remote in Washington, DC 20528	DA	SENIOR_LEVEL	
e01154c4558fef8d	Legal & General America	Sr IT Business Analyst	Frederick, MD 21704	DA	SENIOR_LEVEL	$101,300 - $139,250 a year
3ea0068ed31cdb13	sonataOne	Business Analyst	Fremont, CA	DA	SENIOR_LEVEL	Estimated $110K - $140K a year
90e9d69599022714	Cirque du Soleil	Senior Planning & Business Analyst – Consumer Products	Las Vegas, NV 89119 (Paradise area)	DA	SENIOR_LEVEL	Estimated $88.6K - $112K a year
50f0455ec8cbf24f	Oxygen	Senior Data Analyst - Financial Products	Remote in New Jersey	DA	SENIOR_LEVEL	
7401b0bce200cf1b	Axos Bank	Sr Technical Business Analyst	San Diego, CA 92122 (University City area)	DA	SENIOR_LEVEL	Estimated $84.4K - $107K a year
97e43f1438d7426c	Leidos	Sr Business Analyst	Hybrid remote in Maryland	DA	SENIOR_LEVEL	$84,500 - $152,750 a year
446bcdf42c2bb286	Purdue University	IT Business Analyst, Senior	Indiana	DA	SENIOR_LEVEL	
62c3124294448c77	CNA	Crime Analyst (Sr. Research Specialist) – Center for Justice Research and Innovation	Remote	DA	SENIOR_LEVEL	
7dc34794cdb15dbd	Cornerstone Building Brands	Senior Data Analyst	Houston, TX	DA	SENIOR_LEVEL	
1b4d7b4cb92d904b	Symphony MediaAI	Senior Media Financial Analyst	Hybrid remote in Greenwood Village, CO 80111	DA	SENIOR_LEVEL	$65,000 - $85,000 a year
504edb9e5e7a3dae	Little Rapids Corporation	Sr. Pricing Analyst (FT)	Green Bay, WI 54303	DA	SENIOR_LEVEL	$50,400 - $71,900 a year
0f20e5c939fb92c6	HCSC	Sr BA	Richardson, TX	DA	SENIOR_LEVEL	Estimated $97.8K - $124K a year
18f3850ca100c27f	Oracle	Sr Principal IT Services Analyst - Oracle EBS Techno Functional	California	DA	SENIOR_LEVEL	Estimated $109K - $138K a year
4505ecd5e9aa6f35	Ball State University	Senior Compensation Analyst	Muncie, IN 47306 (Ball State University area)	DA	SENIOR_LEVEL	$70,000 a year
5ee6172ff422fa30	HCSC	Senior BA	Richardson, TX	DA	SENIOR_LEVEL	Estimated $94.8K - $120K a year
6f1b23820b751326	Berkshire Hathaway Energy Company	Sys & Development Analyst I/II/III or Sr Sys & Development Analyst	Glen Allen, VA	DA	SENIOR_LEVEL	Estimated $86.4K - $109K a year
044dbd840b2ad5c2	CHILD DEVELOPMENT ASSOCIATES, INCORPORATED	Senior Data and Research Analyst	Hybrid remote in United States	DA	SENIOR_LEVEL	$112,165.20 a year
998a730f4607134a	HealthVerity	Senior Analyst, Real World Data (RWD) Insights	Hybrid remote in Boston, MA	DA	SENIOR_LEVEL	Estimated $94.4K - $120K a year
df8fff40605808ff	Barry Wehmiller Companies Inc	Sr. ERP Analyst	Clayton, MO	DA	SENIOR_LEVEL	Estimated $83.1K - $105K a year
674b1a78219477ba	HealthVerity	Senior Analyst, Real World Data (RWD) Insights	Hybrid remote in Philadelphia, PA	DA	SENIOR_LEVEL	Estimated $86.8K - $110K a year
40c136a7d61eb4e1	Berkley	Sr. Actuarial Analyst	Minneapolis, MN 55402 (Downtown West area)	DA	SENIOR_LEVEL	
ceb14fa098bc3d7e	TechOp Solutions International	Business Analyst (Team Lead)	Washington, DC 20001 (Shaw area)	DA	SENIOR_LEVEL	
af26a4d712d65780	BRIK Partners	Sr. Data Analyst	Remote in Texas City, TX	DA	SENIOR_LEVEL	$30 - $70 an hour
88c78ec2660e73b3	Blue X Technologies	Data Analyst	Atlanta, GA	DA	SENIOR_LEVEL	
0240a1a3de65e482	Cloud Shift Technologies LLC	Business Analyst	Hybrid remote in Lawrenceville, GA 30043	DA	SENIOR_LEVEL	
073f043e09c5177f	Wellpath	IT Data Analyst Senior	Nashville, TN 37211	DA	SENIOR_LEVEL	
9e753b254c28be89	Pfizer	External Supply Sr. Data Analyst & AI	Collegeville, PA	DA	SENIOR_LEVEL	$113,900 - $189,700 a year
9fc16d546ad565b7	Guild	Sr. Data Quality Analyst (Remote)	Remote in Denver, CO 80211	DA	SENIOR_LEVEL	
e2aac51722ad85bd	Sarum, LLC	Sr. Business Analyst	Harrisburg, PA 17101 (Capitol District area)	DA	SENIOR_LEVEL	
84bff16848c564e4	Farmers National	Senior, Business Analyst	Omaha, NE 68154	DA	SENIOR_LEVEL	Estimated $75K - $94.9K a year
150c90f8db714368	Lucid Technologies Inc	Sr. Data Analyst	Hybrid remote in Atlanta, GA	DA	SENIOR_LEVEL	Estimated $91.9K - $116K a year
e42bd1aba72294a0	Plymouth Rock Assurance	Lead Marketing Data Analyst	Woodbridge, NJ 07095	DA	SENIOR_LEVEL	Estimated $104K - $132K a year
bb19caa91ebf19d9	Booz Allen Hamilton	Business Analyst SME	Hybrid remote in Arlington, VA 22202	DA	SENIOR_LEVEL	$93,300 - $212,000 a year
c06913818f49accc	ERP INTEGRATED SOLUTIONS	Senior Business Analyst	Remote in United States	DA	SENIOR_LEVEL	
c6902468735d3221	Comcast	Sr. Analyst - Forecasting and Analysis	Philadelphia, PA 19103	DA	SENIOR_LEVEL	
3b54c600ce5c9754	Sarum, LLC	Senior Business Analyst	Harrisburg, PA 17110 (Uptown area)	DA	SENIOR_LEVEL	
59005f64552adab7	The Restaurant Group	Business Analyst	Atlanta, GA 30339	DA	SENIOR_LEVEL	
e67395f93ecbf2f1	Quick Services LLC	SME All Source Analyst/Service Cryptologic Component Spt	Fort Meade, MD 20755	DA	SENIOR_LEVEL	
0f465c0405c85f1c	Genentech	Systems Specialist, Workplace Digital Insights - Site Services	San Francisco, CA (Mission Bay area)	DA	SENIOR_LEVEL	Estimated $114K - $144K a year
dbbeaafcdf56bc41	Zai Lab (US) LLC	Sr Business Analyst (IT)	Cambridge, MA 02142 (Kendall Square area)	DA	SENIOR_LEVEL	$100,000 - $110,000 a year
16b6e986990b1145	Toyota Motor Manufacturing Alabama	SAP Senior Analyst, Data Management	Plano, TX 75024	DA	SENIOR_LEVEL	Estimated $98.3K - $124K a year
e438233fc8321a5f	IBM	Sr. Data Quality Analyst	Remote in Washington, DC 20001	DA	SENIOR_LEVEL	Estimated $106K - $135K a year
91002eaa70df3569	Salesforce	Senior Product Analyst, BT Collaboration & Productivity Services	Dallas, TX 75201 (Downtown area)	DA	SENIOR_LEVEL	Estimated $102K - $129K a year
ec2c870f39d4ce51	WIVERSE	Senior Business Analyst (W2 ONLY- NO C2C)	Hybrid remote in Atlanta, GA 30328	DA	SENIOR_LEVEL	
b10fc340ed91fcfc	MindPoint Group	Cybersecurity Data Analyst - TS Clearance	Hybrid remote in Washington, DC 20002	DA	SENIOR_LEVEL	Estimated $132K - $168K a year
954fa8fc3a74b902	Toyota Motor Manufacturing Alabama	Senior Analyst - Analytics & Risk Management	Hybrid remote in Plano, TX 75024	DA	SENIOR_LEVEL	
9686234204b6c97f	Exelon Corporation	Sr. Business Analyst (Hybrid)	Baltimore, MD 21201 (Downtown area)	DA	SENIOR_LEVEL	Estimated $81.4K - $103K a year
5cfed11f78356c14	UPSIDE Foods	Senior ERP Business Analyst	Glenview, IL	DA	SENIOR_LEVEL	Estimated $106K - $134K a year
2962d7ccb51bcf0d	Morehouse School Of Medicine	Sr. Financial Analyst	Atlanta, GA 30310 (Atlanta University Center area)	DA	SENIOR_LEVEL	
b04281ac5b78b49c	TAYS INC	Tableau Business Intelligence SME and User Support Specialist	Baltimore, MD 21235	DA	SENIOR_LEVEL	Estimated $61.6K - $78K a year
f35cdb94a2337a29	Memphis Meats	Senior ERP Business Analyst	Glenview, IL	DA	SENIOR_LEVEL	Estimated $106K - $134K a year
0afcdb67b65a2e2c	City of Santa Monica	Senior Development Analyst	Santa Monica, CA 90401	DA	SENIOR_LEVEL	$8,818 - $10,887 a month
fb3fc35eb3a0763e	Ceres Global Ag Corp.	Sr. Business Analyst	Golden Valley, MN	DA	SENIOR_LEVEL	Estimated $88.9K - $113K a year
afb5c7aa2fea65e3	HCA Healthcare	Sr Data Analyst	Nashville, TN 37203	DA	SENIOR_LEVEL	
b3e43510156b9da2	TechCoreGlobal	Sr. Data Analyst	Philadelphia, PA	DA	SENIOR_LEVEL	$40 - $50 an hour
4af988438cb5b11c	TechCoreGlobal	Senior Data Analyst	Philadelphia, PA	DA	SENIOR_LEVEL	$40 - $45 an hour
9760c099e5d77333	Rush University	Sr Business Analyst - Revenue Cycle	Chicago, IL 60612 (Illinois Medical District area)	DA	SENIOR_LEVEL	
6a42ee9dac9251c6	RUSH University Medical Center	Sr Business Analyst - Revenue Cycle	Chicago, IL 60612 (Illinois Medical District area)	DA	SENIOR_LEVEL	
e306e1e7e44b0b41	FedEx Services	Sr. Data Analyst	Memphis, TN	DA	SENIOR_LEVEL	Estimated $95.1K - $120K a year
5239bdff37097c4d	Denali Advanced Integration	Business Intelligence Analyst III	Redmond, WA 98052 (SE Redmond area)	DA	SENIOR_LEVEL	$120,000 - $190,000 a year
5f5169a9ce9b3cc7	General Dynamics Information Technology	Business Analyst	Doral, FL	DA	SENIOR_LEVEL	Estimated $108K - $137K a year
3630763a42cce6d3	Droguería Betances, LLC	IT Business Analyst	Caguas, PR 00725	DA	SENIOR_LEVEL	$55,000 a year
8b32b7ba80e4cd7c	KK Technologies	Salesforce Business Analyst- Sacramento, CA	Sacramento, CA	DA	SENIOR_LEVEL	
dc0be49d29d93a26	Emergent Biosolutions	Lead Business Analyst OTC, PTP, & Engineering - Remote	Remote in Gaithersburg, MD 20879	DA	SENIOR_LEVEL	Estimated $121K - $153K a year
eeb19f0aeebb9d4a	Exafort	Sr. Business Analyst	Sunnyvale, CA 94086 (East Murphy area)	DA	SENIOR_LEVEL	Estimated $102K - $130K a year
dce7cd2d311b559a	ABS Kids	Senior Data Analyst	Remote	DA	SENIOR_LEVEL	
32dcc7fb25c0aedf	Techhive consulting llc	Sr. Data Modeler/Data Analyst	Remote	DA	SENIOR_LEVEL	
098cca0323fb39fe	Bottomline Technologies	Senior Data Analyst	Portsmouth, NH 03801	DA	SENIOR_LEVEL	Estimated $84.5K - $107K a year
83c0b3912549eef6	Podimetrics	Senior Data Analyst	Remote in Massachusetts	DA	SENIOR_LEVEL	From $110,000 a year
20e8ed3dac750695	FedEx Services	Sr. Data Analyst	Memphis, TN	DA	SENIOR_LEVEL	Estimated $91.7K - $116K a year
243dff0f9ce07e7b	The Walt Disney Company (Corporate)	Sr. Analyst, Data Visualization – Studios (PH)	Burbank, CA	DA	SENIOR_LEVEL	$88,600 - $113,300 a year
1681e67014d2d2a4	Intuit	Staff Business Data Analyst	San Diego, CA 92129 (Torrey Highlands area)	DA	SENIOR_LEVEL	Estimated $108K - $137K a year
6194d67f0eb445a4	UCLA Health	Data Systems Analyst	Los Angeles, CA 90095	DA	SENIOR_LEVEL	$95,900 - $222,100 a year
55092f8e0dc4dfe3	Noblis	Data Analyst (All Levels)	Bethesda, MD	DA	SENIOR_LEVEL	
1ce25813136aac8b	Cardinal Health	Senior Data Analyst, Data Analytics	Remote in United States	DA	SENIOR_LEVEL	$102,000 - $145,700 a year
347877ff2d9c750c	Cloud Security Services	Senior Data Analyst	Remote	DA	SENIOR_LEVEL	
b793047191ab8ba8	Morgner Construction Management	Business Analyst IV	Los Angeles, CA	DA	SENIOR_LEVEL	
d708f3e23e6966f1	Crain Communications	Senior Data Analyst	Remote in Illinois	DA	SENIOR_LEVEL	$90,000 - $130,000 a year
39a1f7e770059111	SKYGEN USA	Senior Data Analyst	Remote	DA	SENIOR_LEVEL	
4b91e363ed27282b	Peloton	Senior Data Analyst, Emerging Business	New York, NY 10011 (Chelsea area)	DA	SENIOR_LEVEL	
de73fa5ed16a7b99	The Church of Jesus Christ of Latter-day Saints	Data Analyst 3	Salt Lake City, UT 84103 (Capitol Hill area)	DA	SENIOR_LEVEL	Estimated $85.7K - $108K a year
2061551c772f5e10	Aptiva Healthcare	Senior Business Analyst with Health Plans Exp	Remote	DA	SENIOR_LEVEL	$45 - $50 an hour
108c1901b5b3fe3c	Citi	Data Governance Senior Analyst - Reference Data (Hybrid)	Tampa, FL	DA	SENIOR_LEVEL	$113,840 - $170,760 a year
4be3f22ecf38ab8f	Techsara solutions Inc	SAO Data Conversion Analyst (Workday)	Hybrid remote in Atlanta, GA 30301	DA	SENIOR_LEVEL	
078f2a8b0d0c917f	National Life Group	Sr Data Solutions Analyst	Hybrid remote in Montpelier, VT 05604	DA	SENIOR_LEVEL	$70,000 - $130,000 a year
66da24832018879d	G Associates LLC	Sr. Technical Business Analyst	Seattle, WA 98101 (Downtown area)	DA	SENIOR_LEVEL	
bb744b480ef44031	Sintra Technologies	Sr Data Analyst- Hybrid Role in Reston, VA	Reston, VA 20191 (South Lakes Dr - Soapstone Dr area)	DA	SENIOR_LEVEL	
9ea211ba49c87b85	Salesforce	Senior Analyst, Global Real Estate Strategy	San Francisco, CA 94105 (Financial District/South Beach area)	DA	SENIOR_LEVEL	$106,200 - $146,000 a year
e2eff6adb5532d44	Verint Systems Inc.	Sr. Client Analyst	Remote	DA	SENIOR_LEVEL	
d24991fb7e091c8c	Tech Aveev LLC	Data Conversion Analyst (Workday)	Hybrid remote in Atlanta, GA 30301	DA	SENIOR_LEVEL	
6f563d4e943a893d	Global Payments (Beamery)	Senior Data Analyst	Oklahoma City, OK	DA	SENIOR_LEVEL	Estimated $86.6K - $110K a year
5cab57ebab77dbb6	Reed Integration, Inc.	Business Analyst	Remote	DA	SENIOR_LEVEL	
ca4bb9a993271e0d	IntelliBridge LLC	Intelligence Analyst SME	McLean, VA 22102	DA	SENIOR_LEVEL	
e0063fc102cb22a5	Intuit	Principal Technical Data Analyst	Mountain View, CA 94043	DA	SENIOR_LEVEL	Estimated $119K - $151K a year
ff98fbb8728d154d	Booz Allen Hamilton	Project Control Analyst, Senior	Remote in Lexington Park, MD	DA	SENIOR_LEVEL	$65,300 - $149,000 a year
109af46ec324143f	Westfield Insurance	Sr. Business Data Analyst	Hybrid remote in Westfield Center, OH 44251	DA	SENIOR_LEVEL	Estimated $87.7K - $111K a year
b8cb485a10d7c126	Keenan & Associates	Sr. Pharmacy Benefits Analyst	Hybrid remote	DA	SENIOR_LEVEL	
417195a4839d6921	Amaze systems	Business Analyst	Edison, NJ 08817	DA	SENIOR_LEVEL	
efb4eb09ee88093f	Relentless Talent	Sr Data Analyst: big data mining SaaS platform & remote	Cleveland, OH	DA	SENIOR_LEVEL	$95,000 - $105,000 a year
8ebe500f0c65300c	S4 Inc.	Joint Electromagnetic Spectrum Operations (JEMSO) Data Analyst	Nellis AFB, NV 89191	DA	SENIOR_LEVEL	$100,000 - $110,000 a year
a2c2253d15e2a899	Primo Water Corporation	Senior Business Analyst - Digital	Tampa, FL 33607 (Oakford Park area)	DA	SENIOR_LEVEL	$99,000 - $125,000 a year
fe50a5c498bb3fed	B. Braun Medical Inc.	Senior Master Data Analyst	Allentown, PA 18109	DA	SENIOR_LEVEL	
51afe52e5825627c	Citi	Data Quality Senior Analyst - AVP (Hybrid)	Tampa, FL	DA	SENIOR_LEVEL	$87,280 - $130,920 a year
c742b373f7bb0193	Cisco Systems	Cost Accounting Data Analyst	San Jose, CA	DA	SENIOR_LEVEL	Estimated $125K - $158K a year
df42c8f616980f9a	UDW	Senior Research Analyst (FT)	Hybrid remote in Sacramento, CA	DA	SENIOR_LEVEL	$70,928.00 - $102,493.60 a year
e0cd8b6becdd73be	Maven Workforce Pvt. Ltd	Data Conversion Analyst (Workday) - [Only USC & GC]	Hybrid remote in Atlanta, GA 30303	DA	SENIOR_LEVEL	
f8445d16ee02b665	2064	Senior Security Sys Analyst-Data Security	Fort Lauderdale, FL	DA	SENIOR_LEVEL	Estimated $61.4K - $77.8K a year
eb4068c71d7d2902	Cox Communications	Data Senior Analyst	Remote in Atlanta, GA	DA	SENIOR_LEVEL	$77,000 - $115,600 a year
311f177ff51d9f1e	Northrop Grumman	Program Cost and Schedule Control Analyst/Principal Program Cost and Schedule Control Analyst	Orlando, FL	DA	SENIOR_LEVEL	$62,200 - $93,400 a year
a5c75a3dc0ac3dd6	Luxottica (LoA Corporate)	Sr Analyst - Business Data	New York, NY 10018 (Clinton area)	DA	SENIOR_LEVEL	$70,506.33 - $111,234.57 a year
b8b48882684e5682	Ampstek LLC	Cloud Data Security Analyst	Plano, TX	DA	SENIOR_LEVEL	
b42e7c0cfa3ca95a	Green solutions	Sr. Technical Business Analyst	Charlotte, NC 28202 (Third Ward area)	DA	SENIOR_LEVEL	
f2b137fe4c2e1b17	Lytx	Senior Analyst (Event Review Operations)	San Diego, CA	DA	SENIOR_LEVEL	$94,500 - $119,500 a year
8f53ce6fcd4df13a	Excela Health Corporate Services	SR. ANALYST, DATA-HYBRID	Greensburg, PA 15601	DA	SENIOR_LEVEL	Estimated $63.6K - $80.5K a year
5316757bcba8765c	Steneral Consulting	Remote work - Need Sr. Data Mapping Analyst - Remote	Remote in United States	DA	SENIOR_LEVEL	
c3eb62ab727f4466	S & K Technologies, Inc.	Business Analyst IT SKMS	Lexington, KY 40513	DA	SENIOR_LEVEL	$95,000 - $110,000 a year
b3cc34cf261b91f6	Quickbase	Senior Business Analyst G&A Remote, US	Remote	DA	SENIOR_LEVEL	
59ce5fde24358dc1	Shift4	Senior Business Analyst III	Tampa, FL 33602 (Downtown area)	DA	SENIOR_LEVEL	
2559c6202f205f5e	Agero	Senior Business Analyst	Remote in Medford, MA	DA	SENIOR_LEVEL	
c6d1866be7acbd02	Signet Jewelers	Senior Marketing Data Analyst - Remote	Remote in Coppell, TX	DA	SENIOR_LEVEL	$70,000 - $85,000 a year
f77e75955a7b6031	IT Hub Inc.	Business Analyst - US Citizens	Leesburg, VA 20176	DA	SENIOR_LEVEL	
08be17e3d5d9fe8d	International SOS	Data Analyst	Philadelphia, PA	DA	SENIOR_LEVEL	Estimated $92.1K - $117K a year
445d99f75d82253e	Mike Albert Fleet Solutions	Sr. Business Analyst	Cincinnati, OH 45241	DA	SENIOR_LEVEL	
ecb844e2ab3ec971	Cambia Health Solutions	Senior Data Insights Analyst	Washington, DC	DA	SENIOR_LEVEL	$91,500 - $149,000 a year
117ce4c7a214cbfb	Workday	Sr. People Technology, Business Analyst	Atlanta, GA	DA	SENIOR_LEVEL	$135,100 - $202,600 a year
fa966d9d7a1a7bec	DHL	Senior Warehouse Mgmt. Systems (WMS) Analyst	DeSoto, TX 75115	DA	SENIOR_LEVEL	Estimated $57.6K - $72.9K a year
8e27fa1cb4fe3f41	FRESENIUS	Remote - Principal Business Analyst	Remote in Waltham, MA 02451	DA	SENIOR_LEVEL	Estimated $95.4K - $121K a year
44b8d0cac7b17fc1	The Walt Disney Company (Corporate)	Sr Analyst, Portfolio Planning & Project Management (Project Hire)	Orlando, FL	DA	SENIOR_LEVEL	
da983e6f76552529	The Church of Jesus Christ of Latter-day Saints	Full-Time Geo Info Systs Senior Analyst - Temple Department	Salt Lake City, UT 84103 (Capitol Hill area)	DA	SENIOR_LEVEL	Estimated $68.2K - $86.3K a year
c4d9affcef614f6e	John Deere	Senior Business Analyst, Cost Accounting	Moline, IL	DA	SENIOR_LEVEL	Estimated $92.3K - $117K a year
50aaf67a3f5387fa	The Millennium Group	Sr. Business Operations Analyst	Charlotte, NC 28202 (Downtown Charlotte area)	DA	SENIOR_LEVEL	$93,000 - $103,000 a year
a91a1c84d9887c90	Octo	Sr. Data Quality Analyst	Reston, VA 20191	DA	SENIOR_LEVEL	Estimated $101K - $128K a year
b323fbe877e3216f	Triumph Group	Contracts Analyst	Park City, UT 84098	DA	SENIOR_LEVEL	
7d2a04d667d183cb	Intuit	Staff Business Analyst	San Diego, CA 92129 (Torrey Highlands area)	DA	SENIOR_LEVEL	Estimated $106K - $134K a year
92857f53041a139b	Logistics Management Institute	Senior Analyst - Talent Management	Tysons, VA	DA	SENIOR_LEVEL	Estimated $96K - $122K a year
1a6f87f9036dc2c8	Hendall Inc	Sr. Public Health Analyst / Behavioral Health SME	Rockville, MD 20850	DA	SENIOR_LEVEL	
7e96271327334522	Heartland Payment Systems	Senior Data Analyst	Jeffersonville, IN 47130	DA	SENIOR_LEVEL	
d2d67b23c82c88d0	EDGE	Sr. Data Analyst: Sales Engineer	Remote in Chicago, IL 60611	DA	SENIOR_LEVEL	
c66df40c756e7df4	Numentica LLC	CONGA Configuration and Data Modeling Analyst	Remote	DA	SENIOR_LEVEL	
8e2e88acde919485	Cornerstone Building Brands	Senior Data Analyst	Houston, TX	DA	SENIOR_LEVEL	$80,000 - $95,000 a year
4506bfbfd2f2bbc6	Cox Communications	Data Senior Analyst	Remote in Baton Rouge, LA 70873	DA	SENIOR_LEVEL	$77,000 - $115,600 a year
0e1e7ed29bce428d	Massachusetts League of Community Health Centers	Senior Qualitative Research Scientist and Qualitative Data Analyst	Boston, MA 02108 (Downtown area)	DA	SENIOR_LEVEL	
79e99f3522e8182f	FedEx Services	Sr. Data Analyst	Memphis, TN	DA	SENIOR_LEVEL	Estimated $91.7K - $116K a year
6125110668181e5c	Integrity Marketing Group	Senior Data Analyst	Dallas, TX 75202 (Downtown area)	DA	SENIOR_LEVEL	Estimated $80.6K - $102K a year
b2bce5c1b1f15b4c	Sarum, LLC	Senior Business Analyst with PMP Certification	Harrisburg, PA 17110 (Uptown area)	DA	SENIOR_LEVEL	$45 - $50 an hour
2a8025b75435bb6a	City of Marysville, WA	Senior Financial Analyst	Marysville, WA 98270	DA	SENIOR_LEVEL	$87,108 - $109,277 a year
da6116d63ef5285c	CGI Group, Inc.	Sr. Data Analyst with AWS Experience - (REMOTE)	Remote in Columbia, SC 29228	DA	SENIOR_LEVEL	Estimated $93.1K - $118K a year
bdd236e970426c21	Pilot IT, LLC	Senior Business Analyst (Oracle)	Remote	DA	SENIOR_LEVEL	
33866a30119bbe36	Onset Technologies	Data Integration Analyst - PostgreSQL	Remote in United States	DA	SENIOR_LEVEL	Estimated $113K - $143K a year
f979390782412662	Fidelity Investments	Senior Client Service Specialist/Associate Analyst, Corporate Actions	Hybrid remote in Jersey City, NJ 07311	DA	SENIOR_LEVEL	$52,000 - $83,000 a year
cda26d024b4d9c93	Cox Communications	Data Senior Analyst	Remote in New Orleans, LA 70123	DA	SENIOR_LEVEL	$77,000 - $115,600 a year
f9b5eb6678ba06aa	Transamerica	Lead Specialist, Business Analysis	Cedar Rapids, IA	DA	SENIOR_LEVEL	$112,000 - $148,000 a year
bda71d2c062ed683	IPT Associates	Program Control Business Analyst Journeyman	Redstone Arsenal, AL	DA	SENIOR_LEVEL	Estimated $94.8K - $120K a year
5627ccc92a6fd457	KOHLS	Senior Analyst Business Analyst- Corporate Partnerships	Menomonee Falls, WI 53051	DA	SENIOR_LEVEL	
e5b3629f5d4f79ca	Altarey	Senior Business Analyst (Consultant)	Hybrid remote in Jersey City, NJ 07302	DA	SENIOR_LEVEL	
428cbd17506f952f	Sienna Systems	Business Analyst Lead	San Antonio, TX	DA	SENIOR_LEVEL	Up to $140,000 a year
5fe6e2c67fcd83bb	Constellation	Sr. Services Analyst - IT (Financial) (Hybrid)	Baltimore, MD	DA	SENIOR_LEVEL	$110,700 - $123,000 a year
ff1b20bd6b66f6ac	Penske Truck Leasing and Logistics	Senior Logistics Analyst	Smyrna, TN 37167	DA	SENIOR_LEVEL	Estimated $67.1K - $84.9K a year
dd75366dc5196772	AssuredPartners	Sr. Pharmacy Benefits Analyst	Hybrid remote in Torrance, CA	DA	SENIOR_LEVEL	$90,000 - $105,000 a year
dff9977c9423f8fa	Commonwealth Financial Network	Senior Business Analyst	Hybrid remote in Waltham, MA 02453	DA	SENIOR_LEVEL	From $105,000 a year
0c501916e6cfd5cf	Phased n Research, Inc.	Air Defense Data Scientist/Analyst, Mid- to Senior-Level	Huntsville, AL 35806	DA	SENIOR_LEVEL	Estimated $78.2K - $99K a year
3e5397d5de8d91bb	Unum	Senior Business Analyst - Hybrid	Hybrid remote in Chattanooga, TN 37402	DA	SENIOR_LEVEL	Estimated $76.8K - $97.2K a year
e844f162e16917f6	Cox Communications	Data Senior Analyst	Remote in West Warwick, RI 02893	DA	SENIOR_LEVEL	$77,000 - $115,600 a year
d2c5d3813b803c64	University of Massachusetts Medical School	Sr Informatics & Analytics Business Analyst- Remote	Shrewsbury, MA 01545	DA	SENIOR_LEVEL	
7ee8685edf8cf820	Cox Communications	Data Senior Analyst	Remote in Omaha, NE 68197	DA	SENIOR_LEVEL	$77,000 - $115,600 a year
7f8404839e73b841	Cox Communications	Data Senior Analyst	Remote in San Diego, CA	DA	SENIOR_LEVEL	$77,000 - $115,600 a year
4316f81c8dc8d439	Cox Communications	Data Senior Analyst	Remote in Phoenix, AZ 85003	DA	SENIOR_LEVEL	$77,000 - $115,600 a year
87268f993bb8f761	Cox Communications	Data Senior Analyst	Remote in Roanoke, VA 24018	DA	SENIOR_LEVEL	$77,000 - $115,600 a year
f97b520571d4eb8a	Xcel Energy	Sr Plant Process Computer Systems Analyst	Denver, CO 80202 (Union Station area)	DA	SENIOR_LEVEL	$79,000 - $112,999 a year
679d7689fc7a1d2e	Cox Communications	Data Senior Analyst	Remote in Pensacola, FL	DA	SENIOR_LEVEL	$77,000 - $115,600 a year
e750f361216072b7	Cox Communications	Data Senior Analyst	Remote in Las Vegas, NV 89105	DA	SENIOR_LEVEL	$77,000 - $115,600 a year
45c567e4c66ca2e3	Medline Industries Inc	Sr. Business Intelligence Developer/Analyst	Mundelein, IL 60060	DA	SENIOR_LEVEL	Estimated $87.1K - $110K a year
591a565f9a39c62a	Cox Communications	Data Senior Analyst	Remote in Oklahoma City, OK 73116	DA	SENIOR_LEVEL	$77,000 - $115,600 a year
bfa5721c491ec787	Cox Communications	Data Senior Analyst	Remote in Tulsa, OK 74145	DA	SENIOR_LEVEL	$77,000 - $115,600 a year
1e62ba7d1a900790	Amazon.com Services LLC	Senior Business Analyst, Selling Partner Insights and Analytics	Seattle, WA	DA	SENIOR_LEVEL	From $94,600 a year
5499cade08ba8e42	IPS Corporation	Sr. Financial Analyst	Chicago, IL	DA	SENIOR_LEVEL	
5a8e8a873be18726	Rocket Mortgage	Senior Data Analyst	Detroit, MI 48226 (Downtown area)	DA	SENIOR_LEVEL	Estimated $84.9K - $107K a year
3b06fc88b53096fe	Ryerson	Senior Digital Business Analyst - IL Lisle	Lisle, IL	DA	SENIOR_LEVEL	Estimated $94.4K - $120K a year
3831c0e40ffd8ca7	CoStar Group	Senior Payroll Analyst	Washington, DC 20005 (Downtown area)	DA	SENIOR_LEVEL	
01f466f0e698a41d	Intuit	Staff Business Data Analyst	Mountain View, CA 94043	DA	SENIOR_LEVEL	Estimated $110K - $139K a year
b6fa577140a843d8	Sumitomo Mitsui Banking Corporation	Compliance Business Officer - Surveillance, Data & Analytics	Hybrid remote in New York, NY 10172	DA	SENIOR_LEVEL	$193,000 - $225,000 a year
ccf16f90331b1ee8	State of Washington Administrative Office of the...	Senior Court Program Analyst	Olympia, WA	DA	SENIOR_LEVEL	$80,112 - $105,096 a year
07fb853ffb231628	Point32Health	Lead SAS Programmer Analyst (TIDE)	Boston, MA	DA	SENIOR_LEVEL	Estimated $111K - $141K a year
5dad7abe12969bb6	Pointwest Technologies Corp	Sr. UX Business Analyst (Media Asset Management)	Remote	DA	SENIOR_LEVEL	
604f609dad791849	Initiate Government Solutions	Senior Technical Business Analyst/PM- Remote- Public Trust	Remote in Washington, DC	DA	SENIOR_LEVEL	
8988c8c8cc55725c	Infotrend	Business Analyst.	United States	DA	SENIOR_LEVEL	Estimated $99.9K - $126K a year
51d7749be2faca8a	Cumming Group	Senior Business Analyst	Los Angeles, CA 90071 (Downtown area)	DA	SENIOR_LEVEL	Estimated $92.4K - $117K a year
5675e20ed74f6047	Capital One	Sr. Business Analyst	McLean, VA	DA	SENIOR_LEVEL	
2c24ea79b8159863	CAYUGACOUNTY.US	Senior Planner/GIS Analyst (FT)	Hybrid remote in Auburn, NY	DA	SENIOR_LEVEL	$65,325 - $74,859 a year
a4e8bbe170179cee	Philadelphia Gas Works	Sustainability Analyst I, II, or Sr.	Hybrid remote in Philadelphia, PA 19122	DA	SENIOR_LEVEL	Estimated $81.5K - $103K a year
041ee84b4547ebc0	Brighton Jones	Sr. Salesforce Business Analyst	Seattle, WA	DA	SENIOR_LEVEL	$100,000 - $150,000 a year
80e72a6380db5485	SunOpta	Senior Business Analyst	Eden Prairie, MN 55344	DA	SENIOR_LEVEL	
070d610d27b3f3ff	Zenius Corporation	Tableau Business Intelligence SME and User Support Specialist (Hybrid)	Hybrid remote in Baltimore, MD 21207	DA	SENIOR_LEVEL	$90,110.93 - $125,940.05 a year
d25ef09fd1aa12ff	MasterBrand Cabinets LLC	IT Sr Analyst, Oracle Transportation Management (OTM)	Remote	DA	SENIOR_LEVEL	Estimated $107K - $135K a year
