Key	Company	Position	Location	Category	Experience_Level	Salary
d6d84a16037b5592	Navitus Health Solutions LLC	Business Analyst, Government Programs, Med-D-Remote	Remote in Appleton, WI 54913	DA	MID_LEVEL	$63,773 - $83,750 a year
49d851f915361b56	La-Z-Boy	Associate Strategy Analyst	Monroe, MI 48162	DA	MID_LEVEL	Estimated $57.4K - $72.7K a year
505875c394ccc139	Nationwide Children's Hospital	Data Analyst - CCE	Columbus, OH 43205 (Livingston Park North area)	DA	MID_LEVEL	Estimated $54.3K - $68.8K a year
2f4032c6779f7020	Washburn University	Application Analyst, Washburn University	Topeka, KS 66621	DA	MID_LEVEL	From $67,997 a year
6d758207a51b31dc	Raytheon	Financial Analyst (RSS Ops) P3 *REMOTE*	Remote in Texas	DA	MID_LEVEL	
c8752c3def4512c0	Center for Justice Innovation	Research and Data Associate	New York, NY 10018 (Clinton area)	DA	MID_LEVEL	
c59b3b29dadea691	Blue Cross & Blue Shield of Rhode Island	Lead Value Based HealthCare Data Analyst	Hybrid remote in Providence, RI 02903	DA	MID_LEVEL	
71127234f13a5d4f	Department of Public Utilities	Energy Analyst	Hybrid remote in Boston, MA 02110	DA	MID_LEVEL	$68,016.52 - $98,517.12 a year
64cf4a3f79bad731	Procter & Gamble	REMOTE, E-commerce, Native Senior Go to Market, Data Analyst	Remote in San Francisco, CA 94105	DA	MID_LEVEL	$100,000 - $143,000 a year
016cb656f52a6272	Metas Solutions	Data Management Analyst II	Atlanta, GA 30341	DA	MID_LEVEL	
79ae24dff28a07aa	DEPARTAMENTO DE SALUD DE PUERTO RICO	Business Intelligence Analyst	San Juan, PR 00918 (Hato Rey Norte area)	DA	MID_LEVEL	Estimated $85.1K - $108K a year
aaba5ce532e3e2cc	Computer Task Group, Inc	Business Analyst	Anchorage, AK 99501	DA	MID_LEVEL	
92359e3d12429bbd	Emergence Health Network	Budget Analyst	El Paso, TX	DA	MID_LEVEL	$22.60 an hour
d5999b3033d498bb	Alterra Mountain Company	Marketing Data Analyst	Denver, CO 80216 (Five Points area)	DA	MID_LEVEL	$63,000 - $95,000 a year
f5879f28bb90beda	Citizant	IT Strategic Planning Business Analyst (100% Remote)	Remote in Chantilly, VA	DA	MID_LEVEL	Estimated $93K - $118K a year
1ffca841b82294fc	RSHARMA	Cognos/PowerBI reports Analyst with P&C	Alpharetta, GA 30022	DA	MID_LEVEL	$60 - $65 an hour
7ea45a1126e10c81	T. Rowe Price	Analyst, Marketing Data Integration (MDI)	Owings Mills, MD	DA	MID_LEVEL	Estimated $72.3K - $91.6K a year
21e42fa25e41d207	Cortina Solutions	W - Data Visualization Specialist	Huntsville, AL 35806	DA	MID_LEVEL	Estimated $73.9K - $93.6K a year
0c0194727a4b5706	Byrne Software Technologies	Services Delivery Business Analyst	Hybrid remote in Rosemont, IL 60656	DA	MID_LEVEL	
58bf7b9ef099d199	Legal & General America	Business Analyst I	Frederick, MD 21704	DA	MID_LEVEL	$74,400 - $102,300 a year
bf2e3fac7eb21246	Seminole Hard Rock Support Services	Data Protection & Compliance Analyst	Hybrid remote in Davie, FL 33314	DA	MID_LEVEL	Estimated $68.8K - $87.1K a year
2397b1ae82c62098	Skillable	Data Analyst	Remote	DA	MID_LEVEL	Estimated $80.5K - $102K a year
a6715446235f8a96	Skillable	Data Analyst	Remote	DA	MID_LEVEL	Estimated $80.5K - $102K a year
c1ffe41ac8f1a6fc	Skillable	Data Analyst	Remote	DA	MID_LEVEL	Estimated $80.5K - $102K a year
b9ecd386caee065b	Autodesk	Principal Sales Analyst	San Francisco, CA (Financial District/South Beach area)	DA	MID_LEVEL	$106,400 - $172,150 a year
37ec9ade6f919880	New York Power Authority	Temporary Treasury Analyst I	White Plains, NY 10601	DA	MID_LEVEL	$33.01 - $49.51 an hour
9f8136abd0ec91ea	CACI	Business Analyst	Norfolk, VA 23510	DA	MID_LEVEL	
f1599d3086f4db85	Lucas-Milhaupt Inc	Information Systems Data Analyst	Cudahy, WI 53110	DA	MID_LEVEL	Estimated $79.5K - $101K a year
035255e935236dc0	E Business International	Technical Business Analyst	Charlotte, NC	DA	MID_LEVEL	
e6d6605b57e58d1b	Oceans Healthcare	Business Intelligence Analyst/Developer	Plano, TX 75024	DA	MID_LEVEL	
76c7b9aad09b0186	WebMD	Analyst, Programmatic & Data Sol	Newark, NJ 07102 (Central Business District area)	DA	MID_LEVEL	Estimated $52.9K - $67K a year
bd4017c5d9b43eb0	Resource Management Associates, LLC	Data Analyst (Data Mapping and Translation on Financial Vertical) (GA725289	Hybrid remote in Atlanta, GA 30334	DA	MID_LEVEL	
f4cf736f32c696be	Ramaley Group, LLC	Business Analyst Consultant	Hybrid remote in Dallas, TX 75201	DA	MID_LEVEL	$90,000 - $110,000 a year
74a02bc54f89bd6c	USAN	Software Business Analyst	Norcross, GA 30071	DA	MID_LEVEL	Estimated $76.4K - $96.7K a year
e488b657b9b86bf7	Comcentia, LLC	Business Intelligence Analyst	Remote	DA	MID_LEVEL	
d604ca047635bde2	INTEL	Business Enablement and Solutions Enterprise Program Analyst	Phoenix, AZ	DA	MID_LEVEL	$70,680 - $106,220 a year
e0efb4fe2dd7cf80	RTD	Business Analyst, Physical Assets	Denver, CO	DA	MID_LEVEL	$87,289.00 - $123,295.75 a year
04cd8ec94ecac970	San Joaquin Delta College	Temporary Benefits and Leave Analyst (25 hours)	Stockton, CA 95207 (Lakeview area)	DA	MID_LEVEL	$38.73 an hour
ce6e6f723e8d5287	SAIC	Business Relationship Management Analyst	Reston, VA 20190	DA	MID_LEVEL	Estimated $97.9K - $124K a year
ec616acf92bd8cbc	Boston University	BIOINFORMATICS DATA ANALYST, School of Medicine, Genetics, Molecular Medicine	Boston, MA 02215 (Kenmore area)	DA	MID_LEVEL	
5801cf67bf6b71cf	Cape Cod Healthcare	Purchasing Analyst	Hyannis, MA	DA	MID_LEVEL	Estimated $54.4K - $68.8K a year
38b818bbddc7d084	GM Financial	Salesforce Analyst I	Hybrid remote in Arlington, TX 76014	DA	MID_LEVEL	Estimated $69.4K - $87.8K a year
61073183a734cbbb	National Grid	Lead Business Analyst	Hybrid remote in Syracuse, NY	DA	MID_LEVEL	$94,000 - $110,000 a year
5a8ede46aa4e03d7	Medline Industries Inc	Customer MDM Business Analyst	Northfield, IL	DA	MID_LEVEL	Estimated $76.8K - $97.3K a year
c8ef6bfaa4e74b88	Alphapointe	Business Analyst	Kansas City, MO 64132 (Marlborough East area)	DA	MID_LEVEL	
ac5907510a63ef7d	Blue Cross Blue Shield of Arizona	Business Analyst - (Hybrid/Remote)	Remote in Phoenix, AZ 85021	DA	MID_LEVEL	
ca4ae76777b42442	Booz Allen Hamilton	Salesforce Business Analyst	Remote in Melbourne, FL	DA	MID_LEVEL	$52,200 - $119,000 a year
a19b490b250b2bd3	MBL Technologies	Program Analyst - (Cyber Operations)	Remote in Washington, DC	DA	MID_LEVEL	
4b9160e1d0ed885b	Novo Nordisk	Associate Business Intelligence Analyst	Clayton, NC 27527	DA	MID_LEVEL	Estimated $71.3K - $90.3K a year
8f33a09aa0a78417	IBM	Power BI Data Analyst	Washington, DC 20001 (Shaw area)	DA	MID_LEVEL	Estimated $101K - $128K a year
a499fe0b79e06e46	InstantServe LLC.	Business Analyst	Houston, TX	DA	MID_LEVEL	
10732c508a7445ae	Groe Advisors	AI/ML Operations Analyst	Woburn, MA 01801	DA	MID_LEVEL	$100,000 - $125,000 a year
afe979dd42e19e9f	University of Florida	IT ANALYST 2	Gainesville, FL 32611	DA	MID_LEVEL	$60,500 - $62,000 a year
6d547ee17667cb1f	Byrne Software Technologies	Health & Human Services Child Care Business Analyst	Rosemont, IL 60656 (Norwood Park area)	DA	MID_LEVEL	From $70,000 a year
f7fecda1a0a60757	TRUSTONE FINANCIAL CREDIT UNION	Card Services Business Analyst	Burnsville, MN 55337	DA	MID_LEVEL	
2d37db1b3ade4966	Surge IT LLC	Business Analyst	Hybrid remote in Richmond, VA 23219	DA	MID_LEVEL	
df12f252ca29aef2	Refresh Mental Health	HRIS Analyst	Remote	DA	MID_LEVEL	
0b4b3e34be7c98d0	Safal Partners	DOL Grant and Data Analyst - Workforce Development	Remote	DA	MID_LEVEL	
51239b748a97e4e9	Sharp Healthcare	Business Intelligence Analyst I	San Diego, CA 92123 (Kearny Mesa area)	DA	MID_LEVEL	
b9997deda1fb209d	TriNet	Business Analyst	Remote	DA	MID_LEVEL	$57,800 - $95,400 a year
06bad690f8e2119c	CBRE	Business Intelligence Analyst	Dallas, TX 75201 (Downtown area)	DA	MID_LEVEL	
b1b435bb1fd2c91a	Mueller, Inc.	Business Analyst (Sales Technology) - Remote	Remote in Ballinger, TX 76821	DA	MID_LEVEL	
927d201b7a456d7e	DCG ONE	DATA SPECIALIST	Upper Marlboro, MD 20774	DA	MID_LEVEL	$25 - $30 an hour
1ddc68de0668b588	E.O. Health & Human Services	Business Analyst	Hybrid remote in Boston, MA 02111	DA	MID_LEVEL	$74,658.74 - $140,157.17 a year
0f812e048a408871	Global HIT	Healthcare Technical Business Analyst W2 Only!!	Remote	DA	MID_LEVEL	$25 - $37 an hour
ae0120d8716b02a3	Pennymac	Business Analyst III	Moorpark, CA 93021	DA	MID_LEVEL	$65,000 - $100,000 a year
3114f0b11418d033	Digital Infuzion, Inc	Data Scientist and Visualization Specialist	Hybrid remote in Maryland	DA	MID_LEVEL	
b018582c23880ecc	TriWest Healthcare Alliance	Business Intelligence Analyst (Quality & Process Improvement Dept.)	Remote in Phoenix, AZ	DA	MID_LEVEL	Estimated $72.2K - $91.5K a year
1cf50125803f4df2	NLC Insurance	Insurance Product Analyst	Hybrid remote in Norwich, CT 06360	DA	MID_LEVEL	From $75,000 a year
1cb91cad865a1b46	Sawdey Solution Services	FOIA Analyst/Specialist	Hybrid remote in Washington, DC 20001	DA	MID_LEVEL	
94f4894ff2de02e5	Emory University	Business Analyst III	Decatur, GA 30030 (Downtown area)	DA	MID_LEVEL	Estimated $75.3K - $95.4K a year
8d4b23cae54660eb	U.S. Bank National Association	Business Analyst 2	Minneapolis, MN 55402 (Downtown West area)	DA	MID_LEVEL	$56,950 - $73,700 a year
4d71d204f5fb3e4b	Red Bull North America	Sales Analyst	Santa Monica, CA 90403	DA	MID_LEVEL	Estimated $64K - $81K a year
b67bddaa442e3104	University of Utah	Business Analyst	Hybrid remote in Salt Lake City, UT 84112	DA	MID_LEVEL	$47,600 - $70,000 a year
cc16e8bab272d546	North Carolina Education Lottery	Business Analyst - Raleigh [60088554]	Raleigh, NC 27604 (Northeast area)	DA	MID_LEVEL	$67,984 a year
02aa21a103ace614	H-E-B	Business Analyst II - Enterprise Program Management	San Antonio, TX 78204 (Lone Star area)	DA	MID_LEVEL	Estimated $70.2K - $88.8K a year
bfb920307c6ac769	Epsilon	Senior Data Analyst	Irving, TX 75039 (Freeport/Hackberry area)	DA	MID_LEVEL	Estimated $81.2K - $103K a year
c587ebc4fb8f86d2	Cleanslate Group	Business Intelligence Analyst	Linden, NJ 07036	DA	MID_LEVEL	
1c9e894a987ddd74	Zions Bancorporation	Data Analytics Business Analyst	Hybrid remote in Salt Lake City, UT	DA	MID_LEVEL	Estimated $80.1K - $101K a year
048d9a7327c296d2	Whirlpool	Senior Analyst, Human Resources Data Management & Customer Service	Benton Harbor, MI	DA	MID_LEVEL	Estimated $71.5K - $90.6K a year
c0ee79327ae3ef74	Citi	Testing Technical Lead Analyst	Hybrid remote in Irving, TX	DA	MID_LEVEL	$140,000 - $158,000 a year
8fcd7ea5a71f5370	New England Life Care	Business Analyst	Canton, MA 02021	DA	MID_LEVEL	Estimated $67.8K - $85.9K a year
63263527db0393a4	Washington University in St Louis	CRM Slate Analyst - Office of Graduate Studies, Admissions	St. Louis, MO 63130	DA	MID_LEVEL	$52,000 - $88,800 a year
e2598c32ac3a37a7	GAP Solutions, Inc.	Computer Systems Analyst (Microsoft Power Platform)	Bethesda, MD 20810	DA	MID_LEVEL	Estimated $78.3K - $99.1K a year
3b2db0742ae3c96b	Infologitech	HR Automation Business Analyst	Raleigh, NC 27604 (Northeast area)	DA	MID_LEVEL	
b3dbd58319723cd8	STV Group	Business Analyst IV	Los Angeles, CA	DA	MID_LEVEL	$104,158 - $139,666 a year
2659406ddea080cd	Raag Solutions	Business Analyst - Project Lead	Columbia, SC	DA	MID_LEVEL	Estimated $105K - $133K a year
aabc9d87d3fd08a5	Parkland Health and Hospital System	Business Analyst - PCHP	Dallas, TX 75201	DA	MID_LEVEL	Estimated $51.3K - $65K a year
ec98245da7fc056c	U-Haul	Business Analyst I	Phoenix, AZ 85004 (Encanto area)	DA	MID_LEVEL	Estimated $70.7K - $89.5K a year
ded032f226ca9af8	Carpenter Technology	Data Analyst - Supply Chain	Reading, PA	DA	MID_LEVEL	Estimated $63.3K - $80.1K a year
ce656d1039ef03e2	Buhler Group	Business Intelligence Analyst	Plymouth, MN 55441	DA	MID_LEVEL	
7d550600b151636e	Hasbro	Sr Business Analyst For Walmart	Bentonville, AR	DA	MID_LEVEL	Estimated $79.2K - $100K a year
8d3fc7fa5d5bb523	Venatore Llc	Business Analyst	Doral, FL 33178	DA	MID_LEVEL	
0d46804e861a37fd	Northern Kentucky University	Sr. Business Analyst	Highland Heights, KY	DA	MID_LEVEL	Estimated $60.5K - $76.6K a year
237174142e06e026	Houlihan Lokey	Compliance Business Analyst	Los Angeles, CA	DA	MID_LEVEL	Estimated $82.8K - $105K a year
8f04918cb54f5b52	The Carian Group	Business Analyst / Cost Analyst	South Plainfield, NJ 07080	DA	MID_LEVEL	Estimated $79.2K - $100K a year
07f5c25381911ea4	Zions Bancorporation	Data Analytics Business Analyst	Hybrid remote in Salt Lake City, UT 84133	DA	MID_LEVEL	Estimated $80.1K - $101K a year
390251c14048c2bf	Imbibe	Business Analyst	Niles, IL 60714	DA	MID_LEVEL	
07b315b199ffbcb4	The University of Bridgeport	Business Analyst	Bridgeport, CT 06604 (South End area)	DA	MID_LEVEL	Estimated $67.1K - $85K a year
886bef642040f731	University of Maryland, Baltimore	Business Intelligence Report Writer for Data Analytics and Reporting (Partial Remote Schedule)	Hybrid remote in Baltimore, MD	DA	MID_LEVEL	$60,000 - $67,000 a year
c99a9b67bab3786e	Care Alliance Health Center	Report Analyst	Cleveland, OH 44114 (Downtown area)	DA	MID_LEVEL	
9fe8a14aed7f1a59	University of Central Florida	Finance/Budget Analyst II	Orlando, FL 32816	DA	MID_LEVEL	$56,030 a year
ac2ca4685d0cc2a8	Minneapolis Public Housing Authority	Senior Business Analyst ERP	Minneapolis, MN 55401 (North Loop area)	DA	MID_LEVEL	$74,693 - $109,512 a year
7e578be1188f42fc	TriSearch	3147 Business Analyst	Sparks Glencoe, MD	DA	MID_LEVEL	Estimated $81.4K - $103K a year
6dc8239e77f3a95b	DAWSON	Print Services Analyst	Washington, DC 20229 (Downtown area)	DA	MID_LEVEL	$65,000 - $75,000 a year
770acec0913a69be	College of Lake County	Business Analyst	Grayslake, IL 60030	DA	MID_LEVEL	$57,673 a year
10968d0e9c866fa6	Hospital for Special Care	BENEFITS ANALYST	New Britain, CT 06053	DA	MID_LEVEL	Estimated $61.5K - $77.9K a year
46f5135e54bffab2	Colas	Payroll Business Analyst	Denver, CO 80237 (Southeastern Denver area)	DA	MID_LEVEL	$134,000 - $140,000 a year
99a39c1c06232b15	Plateau Software Inc	Operational Research Systems Analyst/ORSA	Tampa, FL 33608 (MacDill AFB area)	DA	MID_LEVEL	
b60bf2858fbb503b	Cowan Systems and Cowan Management	Sr. Business Analyst	Baltimore, MD 21227	DA	MID_LEVEL	
7b1affe1c6e93ff0	Danessa Myricks Beauty	Business Intelligence Analyst (FT)	Farmingdale, NY	DA	MID_LEVEL	$60,000 - $65,000 a year
58e4a61b93fb3224	Summit Consulting	Financial Management Analyst	Washington, DC 20001 (Swampoodle area)	DA	MID_LEVEL	$70,000 - $80,000 a year
5d1b58471560f2d0	Hackensack Meridian Health	Research Business Analyst	Neptune City, NJ 07753	DA	MID_LEVEL	Estimated $72.9K - $92.4K a year
c0a2d557d413d867	DAWSON	Print Services Analyst	Washington, DC (Downtown area)	DA	MID_LEVEL	$65,000 - $75,000 a year
30db339e6780964a	SmartBear	Global Total Rewards Analyst	Hybrid remote in Somerville, MA 02145	DA	MID_LEVEL	Estimated $85K - $108K a year
4cb743b5f9b8cb78	Exelon Corporation	Business Analyst	Philadelphia, PA 19103 (Logan Square area)	DA	MID_LEVEL	Estimated $68K - $86.1K a year
bd3ecb5163d86f46	Credence Management Solutions, LLC	Senior Business Analyst / Subject Matter Expert	Remote	DA	MID_LEVEL	
644d4b3c85b4642e	Tetrad Digital Integrity LLC	Cloud Cybersecurity Analyst	Suffolk, VA 23435	DA	MID_LEVEL	Estimated $87.4K - $111K a year
3bb53ba3b06071a6	Navitus Health Solutions LLC	Business Analyst, FFS Medicaid Claims- remote	Remote in Madison, WI 53717	DA	MID_LEVEL	$63,773 - $83,750 a year
109b9bf5e6af4cb6	Navitus Health Solutions LLC	Business Analyst, FFS Medicaid Claims- remote	Remote in Austin, TX 78759	DA	MID_LEVEL	$63,773 - $83,750 a year
5ca6554d04bb643a	Axle Informatics	NIH: NIAID: Scientific Program Data Analyst	Hybrid remote in Bethesda, MD 20892	DA	MID_LEVEL	$76,145 - $82,760 a year
11d491735ddaf121	MUFG Bank, Ltd.	Loan Reference Data Analyst	Hybrid remote in Tempe, AZ 85288	DA	MID_LEVEL	$65,000 - $80,000 a year
c83c28a48aaa073f	Booz Allen Hamilton	Business Analyst	Hybrid remote in McLean, VA	DA	MID_LEVEL	$52,100 - $119,000 a year
36b30e2229ce4bb2	University of South Florida	Fiscal & Business Analyst I	Tampa, FL 33620 (Terrace Park area)	DA	MID_LEVEL	$41,000 a year
b4b128541e5f38b8	Intone Networks	Business Analyst	Hoboken, NJ	DA	MID_LEVEL	
7f37b72bcd377b48	INCATech LLC	Financial/Business Analyst	Washington, DC	DA	MID_LEVEL	Estimated $84.7K - $107K a year
630292e2b4750b3a	Merck Sharp & Dohme	Contracting Analytics & Insights Analyst, Oncology & Rare Disease	Hybrid remote in North Wales, PA 19454	DA	MID_LEVEL	Estimated $94.9K - $120K a year
9255434efbb3172b	Symrise	Sustainability Analyst	Teterboro, NJ 07608	DA	MID_LEVEL	
655537abafd3a6bc	Intuit	Staff Business Data Analyst	Mountain View, CA 94043	DA	MID_LEVEL	Estimated $107K - $136K a year
61feeefa3638c1b5	Mazzella Companies	Market Research Analyst	Cleveland, OH 44142 (Riverside area)	DA	MID_LEVEL	Estimated $56K - $70.9K a year
87fe7e8b16a299ae	Athletico Physical Therapy	Accounting Analyst - Hybrid	Oak Brook, IL 60523	DA	MID_LEVEL	Estimated $49.5K - $62.7K a year
2dcfb5c12cd90ef1	Georgia-Pacific	SAP Master Data Systems Analyst	Atlanta, GA 30301 (Buckhead area)	DA	MID_LEVEL	Estimated $87.3K - $111K a year
e6219f26ea0c895d	uniQure	IT Business Analyst/ Application Engineer - GxP Systems	Lexington, MA 02421	DA	MID_LEVEL	Estimated $106K - $134K a year
41991002912a93bb	ManTech International Corporation	Technical Executive Support Analyst	Portsmouth, VA	DA	MID_LEVEL	Estimated $60.4K - $76.5K a year
7b87728394fa9707	Newbold Advisors	Business Analyst -Mortgage Technology	Hybrid remote in Cherry Hill, NJ 08002	DA	MID_LEVEL	
7e90674c169ed520	FOCUSED HR SOLUTIONS LLC	LU-SharePoint BA-QA	Raleigh, NC 27605 (Hillsborough area)	DA	MID_LEVEL	
56bc5e9c7ca9bd7b	Family Health Centers of San Diego	Business Analyst II (SUD Services)	San Diego, CA 92102 (Mt. Hope area)	DA	MID_LEVEL	Estimated $60K - $76K a year
05faba4ef729d4f2	U.S. Bank National Association	Business Analyst 2	Overland Park, KS 66210	DA	MID_LEVEL	$56,950 - $73,700 a year
35e2fd30c49aaf1d	Navitus Health Solutions LLC	Business Analyst, Government Programs, Med-D-Remote	Remote	DA	MID_LEVEL	$63,773 - $83,750 a year
acfa288159722533	Leidos	ITSM Analyst/ITSM Specialist	Maryland	DA	MID_LEVEL	$59,150 - $106,925 a year
cfd901b9df68b690	Raymond James Financial	Sr Project Management Business Analyst	Hybrid remote in Saint Petersburg, FL 33716	DA	MID_LEVEL	Estimated $87.3K - $111K a year
a7e03e465cb868d2	Fifth Third Bank	LOB Lead Business Analyst-Mortgage	Cincinnati, OH	DA	MID_LEVEL	Estimated $95.2K - $121K a year
92c5ff36e549003e	SAIC	Business Relationship Management Analyst	Huntsville, AL 35806	DA	MID_LEVEL	Estimated $92.5K - $117K a year
2d1438279c7f8375	INTEL	Business Enablement and Solutions Enterprise Program Analyst	Folsom, CA	DA	MID_LEVEL	$70,680 - $106,220 a year
7ead91ff358f5445	HealthVerity	Lead Analyst, Real World Data (RWD) Insights	Hybrid remote in Boston, MA	DA	MID_LEVEL	Estimated $101K - $127K a year
162b3779ffd5fc75	INTEL	Business Enablement and Solutions Enterprise Program Analyst	Hillsboro, OR	DA	MID_LEVEL	$70,680 - $106,220 a year
8bd94d1f37f6d11a	Franklin Electric	ERP Business Analyst	Fort Wayne, IN	DA	MID_LEVEL	Estimated $79.2K - $100K a year
f72a9c644c517217	CPM One Source	Business Analyst I	Los Angeles, CA 90058	DA	MID_LEVEL	$74,000 - $81,000 a year
882f72b49c0d025b	WIVERSE	Salesforce Business Analyst (W2 Only- NO C2C)	Atlanta, GA 30328	DA	MID_LEVEL	$55 - $60 an hour
0cf5ee3dc7cd9d15	New England Life Care	Business Analyst	Concord, NH 03301	DA	MID_LEVEL	Estimated $68.1K - $86.2K a year
da6425d5e17d5994	YSI	Business Analyst	Remote	DA	MID_LEVEL	$75,000 - $85,000 a year
458e906da0480234	PNC Financial Services Group	Business Analysis Advisor - Enterprise Change Office	Pittsburgh, PA 15222 (Strip District area)	DA	MID_LEVEL	Estimated $91.7K - $116K a year
10b4482286deb15e	FOCUSED HR SOLUTIONS LLC	LU--Business Analyst -Phoenix, AZ. -9-28	Phoenix, AZ 85007 (Central City area)	DA	MID_LEVEL	Estimated $78.4K - $99.2K a year
aac41902bb581cd2	Indian Creek Foundation	Board Certified Behavior Analyst (BCBA)	Souderton, PA 18964	DA	MID_LEVEL	
db84684b223fe7b1	New England Life Care	Business Analyst	Scarborough, ME 04074	DA	MID_LEVEL	Estimated $68.1K - $86.2K a year
3a7f4cf07e9a37f9	New England Life Care	Business Analyst	Remote in United States	DA	MID_LEVEL	Estimated $68.5K - $86.7K a year
87f2cdee5afe754a	HealthVerity	Lead Analyst, Real World Data (RWD) Insights	Hybrid remote in Philadelphia, PA	DA	MID_LEVEL	Estimated $92K - $117K a year
6ec08141f815ac1c	Zions Bancorporation	Data Analytics Business Analyst	Hybrid remote in Salt Lake City, UT	DA	MID_LEVEL	Estimated $80.1K - $101K a year
ee5a50ae89a77b6b	DePaul University	ERP Developers/Business Analysts	United States	DA	MID_LEVEL	Estimated $75.5K - $95.6K a year
be38533d3da3b922	New England Life Care	Business Analyst	Woburn, MA 01801	DA	MID_LEVEL	Estimated $67.8K - $85.9K a year
5c1c25404a6568cc	Roku	Salesforce Business Analyst	New York, NY 10036 (Garment District area)	DA	MID_LEVEL	$124,900 - $157,300 a year
7eb7f8c21be9c367	Wintrust Financial	Senior Business Analyst	Rosemont, IL 60018	DA	MID_LEVEL	Estimated $76.8K - $97.3K a year
1b904a5fef32c5c7	Leidos	ITSM Analyst/ITSM Specialist	Washington, DC	DA	MID_LEVEL	$59,150 - $106,925 a year
cbe4912c4f736af9	YETI	Customer Analytics, Data Analyst	Hybrid remote in Austin, TX 78704	DA	MID_LEVEL	
29a2a451d8a33b91	Clair	Data Analyst	Hybrid remote in New York, NY	DA	MID_LEVEL	
4675f4a15559efa8	Mars	Q&FS Data Analyst	Franklin, TN 37064	DA	MID_LEVEL	Estimated $67.5K - $85.4K a year
889d8f182fd75e68	Greif	Ecommerce Data Analyst	Remote	DA	MID_LEVEL	
3d769a377bee847a	GTI Technologies Inc	Event Analyst / Trade Show Data Specialist	San Diego, CA 92126 (Miramar area)	DA	MID_LEVEL	
0725530fbcc95bf2	BENlabs	Product Data Analyst	Remote in Provo, UT	DA	MID_LEVEL	
e7c4d0b6de69dec1	Oliver Healthcare Packaging	Data Analyst	New Britain, PA	DA	MID_LEVEL	
0f2bb9cad3ada073	Health & Human Services Comm	Data Analyst IV	Austin, TX 78751 (Hyde Park area)	DA	MID_LEVEL	$5,167 - $6,815 a month
955f82e7fd0a0b1b	Cooper Green	Clinical Data Analyst	Birmingham, AL 35233 (Five Points South area)	DA	MID_LEVEL	
5a5a53dfbf760042	Hoyleton Youth and Family Services	Data Analyst III	Fairview Heights, IL 62208	DA	MID_LEVEL	
f28fad9827398ea9	Rangam Infotech Pvt Ltd	Master Data Analyst (SAP)	Iowa City, IA 52240 (Creekside area)	DA	MID_LEVEL	$40 - $50 an hour
f53201e00c0a96a5	AR Val services	Data Analyst/Document Control	Irvine, CA 92602 (Orchard Hills area)	DA	MID_LEVEL	
80888fc44dab636a	Lockheed Martin Corporation	Data Scientist Analyst / Orlando, FL	Orlando, FL	DA	MID_LEVEL	Estimated $93.1K - $118K a year
9a5615d15b84dddc	Tekshapers Inc	Metadata Analyst (Data Analyst)	Remote	DA	MID_LEVEL	
31745543fe81567a	LifeQuest Organ Recovery Services	Data Quality Analyst	Gainesville, FL	DA	MID_LEVEL	
6f45ef5ab72d816f	Bechtel	Data Analyst & Reporting Specialist	Hybrid remote in Knoxville, TN	DA	MID_LEVEL	Estimated $78.5K - $99.4K a year
2ab31003e56d99bd	Publix	Marketing Analytics Data Analyst – CRM, Marketing – Lakeland	Lakeland, FL 33815	DA	MID_LEVEL	$70,000 - $107,000 a year
c820156c7c335fb8	Publix	Marketing Business Analytics Data Analyst, Marketing – Lakeland	Lakeland, FL 33811	DA	MID_LEVEL	$70,000 - $107,000 a year
72fbd705c6c1827f	Louisiana Primary Care Association	Data Analyst	Baton Rouge, LA 70806 (Tara area)	DA	MID_LEVEL	$39,250 - $72,950 a year
b2088ae0e3f792a8	State of South Carolina	Oral Health Data Analyst (Program Coordinator II) - 61007778-158562	Hybrid remote in Columbia, SC 29210	DA	MID_LEVEL	$45,530 a year
7c08a0d132b0e866	Marex	Business Analyst (Clearing & Prime Services)	New York, NY	DA	MID_LEVEL	
2cebe6dc0de09f82	Milliman	Data Analyst - Indianapolis Health	Indianapolis, IN 46204	DA	MID_LEVEL	
c08a1fd1152d2ef8	Hilltop Securities	HFA TBA Data Analyst	New York, NY 10022 (Midtown area)	DA	MID_LEVEL	
89f8dc755cb2f06a	Grainger	Customer Coverage Analyst	Illinois	DA	MID_LEVEL	$69,000 - $94,000 a year
e1fbc32abd8d74b6	City of Chula Vista, CA	Human Resources Analyst (HR Operations Option)	Chula Vista, CA	DA	MID_LEVEL	$6,579.02 - $7,996.84 a month
80c928908bb89492	3G Federal Solutions, LLC	REMOTE role :- Metadata Analyst	Remote	DA	MID_LEVEL	
fbcf8cf06f4b93bb	Illumination Works LLC	Data Analyst	Dayton, OH 45431	DA	MID_LEVEL	Estimated $83.2K - $105K a year
271559585c5c5aa4	Brillient Corporation	Business Analyst	Remote	DA	MID_LEVEL	
ada61e7a8a477f87	Infologitech	Data Analyst	Atlanta, GA 30302 (Vine City area)	DA	MID_LEVEL	
f6f73669a7726343	Magellan Health	PFC Program Business Analyst (Remote)	Remote in United States Minor Outlying Islands	DA	MID_LEVEL	From $58,440 a year
e6db494be6397776	Optum	Clinical Data Analyst - Remote	Remote in Eden Prairie, MN 55346	DA	MID_LEVEL	
8274b88639d89236	Hagerty Consulting Inc	GIS/Data Analyst	Hybrid remote in Sacramento, CA 95899	DA	MID_LEVEL	
82956d5f6f006e92	Sentara Healthcare	Senior Business Analyst	Virginia Beach, VA 23462 (Kempsville area)	DA	MID_LEVEL	Estimated $74.6K - $94.5K a year
c8a2a28528288f4d	Standard Chartered	Lead Data Analyst – Borrower in Custody Program	New York, NY	DA	MID_LEVEL	$101,421 - $152,131 a year
7158cc8bbd31e533	Anderson Trucking Service	Senior Business Analyst	Saint Cloud, MN 56301	DA	MID_LEVEL	$90,000 - $120,000 a year
4a9faccfee50f1b7	Salt River Project	HR Executive Analyst	Hybrid remote in Tempe, AZ	DA	MID_LEVEL	Estimated $81.9K - $104K a year
df87c52fad78b6b6	CDC Foundation	Data Visualization Specialist	Texas	DA	MID_LEVEL	$75,000 a year
31daf4cdbcc7a5a3	Lockheed Martin	Data Scientist Analyst / Orlando, FL	Orlando, FL 32819 (Florida Center area)	DA	MID_LEVEL	
fd4aba160e79e3c8	Minth North America	Business Analyst	Hybrid remote in Wixom, MI 48393	DA	MID_LEVEL	Estimated $84.5K - $107K a year
bb1991e722a5f0f9	Unicity USA Inc	Business Analyst	Sheridan, WY 82801	DA	MID_LEVEL	
36b97567b2b03541	Skillable	Data Analyst	Remote	DA	MID_LEVEL	Estimated $80.5K - $102K a year
eeb0e0df13e96f34	Purepath Technologies	Metadata Analyst - w2 only	Remote	DA	MID_LEVEL	
1f7cd4e04dc0a53d	Chesterfield County, VA	Fire Planning & Research GIS Analyst	Chesterfield, VA	DA	MID_LEVEL	$68,123 - $91,965 a year
ef5c5f92f178eb36	A1 Management & Inspection, Inc	Business Analyst IV	Los Angeles, CA 90034 (Beverlywood area)	DA	MID_LEVEL	
