0a6c240c42677988	FOCUSED HR SOLUTIONS LLC	Business Analyst rec LU	Remote	BA	ENTRY_LEVEL	Estimated $81.8K - $104K a year
6c2e67da840f182e	Edward Jones	Trade Operations Analyst	Hybrid remote in Tempe, AZ 85285	BA	ENTRY_LEVEL	$68,105 - $112,305 a year
23cb7f2c6672ef94	Edward Jones	Trade Operations Analyst	Hybrid remote in St. Louis, MO	BA	ENTRY_LEVEL	$68,105 - $112,305 a year
c038e351c7f2edb2	Broward Health	Business Systems Analyst-Business Application Support	Fort Lauderdale, FL	BA	ENTRY_LEVEL	Estimated $69.1K - $87.6K a year
f2b9b270d021fb5a	Glanbia Business Services	HR Business Analyst Early Careers Associate	Hybrid remote in Aurora, IL 60504	BA	ENTRY_LEVEL	Estimated $70.1K - $88.7K a year
3d7589e747c20dfa	Dynatrace	Sales Operations Analyst (Onsite - Waltham, MA)	Waltham, MA	BA	ENTRY_LEVEL	$64,000 - $75,000 a year
11384e2817186591	Commonwealth of Virginia	Business Systems Analyst	Fairfax, VA	BA	ENTRY_LEVEL	From $82,000 a year
267c7fff99d31b5d	Farm Credit Mid-America	IT Business Analyst	Louisville, KY 40299	BA	ENTRY_LEVEL	$68,625 - $165,020 a year
02ee044699c8d3f5	Oregon Health Authority	988 & Behavioral Health Crisis System Implementation Coordinator (Operations & Policy Analyst 3)	Hybrid remote in Salem, OR	BA	ENTRY_LEVEL	$5,747 - $8,831 a month
e9f37c27248fc7b8	Northside Hospital	Security Operations Analyst	Atlanta, GA	BA	ENTRY_LEVEL	NA
31c38385aea96d61	Johns Hopkins University	Investment Operations Analyst	Hybrid remote in Baltimore, MD 21211	BA	ENTRY_LEVEL	$84,700 - $148,300 a year
fe7985f1ea54ba8b	Calpine Energy Solutions, LLC	CCA Operations Analyst	San Diego, CA 92101	BA	ENTRY_LEVEL	$54,984.95 - $81,102.60 a year
4c7e90d3fedd2eca	Commonwealth of Virginia	Business Systems Analyst	Virginia	BA	ENTRY_LEVEL	From $82,000 a year
9d0d95cf55424be1	Prosoft Associates	Business System Analyst	Washington, DC 20016 (Van Ness area)	BA	ENTRY_LEVEL	Estimated $84.9K - $108K a year
f39656816e4b4e8f	STERIS	Operations Manager	St. Louis, MO 63133	BA	ENTRY_LEVEL	NA
ee30f329f3d3e578	Las Palmas Medical Center	OR Coordinator Analyst Business	El Paso, TX 79902 (Central area)	BA	ENTRY_LEVEL	NA
5b9320a896566222	Meeting Protocol	Financial Operations Analyst I	Dallas, TX 75248 (Far North area)	BA	ENTRY_LEVEL	NA
38a708c2c689c22e	US Immediate Office of the Chief of Naval...	INTERDISCIPLIARY GENERAL ENGINEER/OPERATIONS RESEARCH ANALYST/MATHEMATICAL STATISTICIAN/STATISTICIAN	Norfolk, VA	BA	ENTRY_LEVEL	$57,824 - $90,946 a year
ff1f52454a90c11b	State of Washington	Financial and Business Analyst	Remote in Olympia, WA 98504	BA	ENTRY_LEVEL	$72,552 - $97,596 a year
6fc112a7cd0e9242	Reynolds and Reynolds	Entry Level Business Analyst	Dayton, OH 45430	BA	ENTRY_LEVEL	Estimated $56.6K - $71.7K a year
8634cb7860b4fdb4	First Horizon Bank	Jr. IT BUSINESS ANALYST	Lafayette, LA 70501	BA	ENTRY_LEVEL	Estimated $58.2K - $73.7K a year
e4ffed410d20abba	California Highway Patrol	ASSOCIATE BUSINESS MANAGEMENT ANALYST	Sacramento County, CA	BA	ENTRY_LEVEL	$5,518 - $6,907 a month
396e88fd5675fbe2	University of North Texas System	Business Data Analyst I	Denton, TX	BA	ENTRY_LEVEL	Estimated $52.9K - $67K a year
a384dabd64d18cd5	Cambridge Investment Research, Inc.	Business Strategy Strategic Analyst	Fairfield, IA 52556	BA	ENTRY_LEVEL	$52,000 - $60,000 a year
fcebd6a26e94bb0f	Information Technology Services, Office of	Business Systems Analyst 1	Albany, NY 12242 (Central Avenue area)	BA	ENTRY_LEVEL	$63,108 - $80,248 a year
3e498ec0833ed569	BCVS group Inc.	Business Analyst	Boston, MA	BA	ENTRY_LEVEL	NA
1e6d06772b67a467	Exadel	Findur Business Analyst – LATAM	United States	BA	ENTRY_LEVEL	Estimated $85.8K - $109K a year
e64a4894f7f29be9	Ryan Specialty, LLC	Business Process Analyst	Atlanta, GA 30342 (Buckhead area)	BA	ENTRY_LEVEL	$50,000 - $90,000 a year
3695d74e2d6487ba	Avery Brewing	Business Analyst	Grand Rapids, MI	BA	ENTRY_LEVEL	NA
9be54220188dfef0	Founders Brewing Co.	Business Analyst	Grand Rapids, MI (Heartside area)	BA	ENTRY_LEVEL	NA
b93b2fbc086203df	Eye Care Partners Career Opportunities	Contract Configuration Analyst	Remote in St. Louis, MO	BA	ENTRY_LEVEL	Estimated $56.1K - $71K a year
827dd3c69a5d8dc5	Serco North America	Business Analyst - Virginia Beach, VA	Remote in Virginia Beach, VA 23455	BA	ENTRY_LEVEL	Estimated $83.7K - $106K a year
3dfe76604c93d454	Ingram Content Group	Business Systems Analyst	La Vergne, TN 37086	BA	ENTRY_LEVEL	Estimated $66.7K - $84.4K a year
9d8f5c5ce0e822e3	Franklin County Data Center	UX Business Analyst	Hybrid remote in Columbus, OH 43215	BA	ENTRY_LEVEL	$75,000 - $95,000 a year
518e47c57e39ba08	George Mason University	Business Systems Analyst	Fairfax, VA 22030	BA	ENTRY_LEVEL	$82,000 a year
bcb610d8abc7e058	State of Washington Office of the Governor	Financial and Business Analyst	Olympia, WA	BA	ENTRY_LEVEL	$72,552 - $97,596 a year
d6739bd320299e17	US Architect of the Capitol	Business Financial Analyst	Washington, DC	BA	ENTRY_LEVEL	$94,199 - $145,617 a year
c839cde2f2a47b5d	Second Harvest Foodbank of Southern Wisconsin	Business Data & Process Analyst	Madison, WI 53711	BA	ENTRY_LEVEL	NA
497c93c46ddf0d64	Artint Knowledge Tech	ServiceNow Business Analyst(Only W2)	San Antonio, TX 78201 (Prospect Hill area)	BA	ENTRY_LEVEL	$70 - $80 an hour
84527200aec73908	The Joint Commission	Standards Business Analyst I - hybrid work model	Hybrid remote in Oakbrook Terrace, IL 60181	BA	ENTRY_LEVEL	NA
02239bf49b3a46d7	Dignari	Business Development Analyst | HYBRID	Washington, DC 20004 (Downtown area)	BA	ENTRY_LEVEL	Estimated $78.4K - $99.3K a year
72dd675101282e26	Red Hat Software	Operations Analyst	Remote in Raleigh, NC 27601	BA	ENTRY_LEVEL	NA
36064728915d5ab9	Northside Hospital Inc.	Security Operations Analyst	Atlanta, GA 30342 (Buckhead area)	BA	ENTRY_LEVEL	Estimated $65.6K - $83.1K a year
5291c4eb616b3901	Source Mantra	Business Analyst with ERP	Houston, TX 77003 (Downtown area)	BA	ENTRY_LEVEL	NA
1121c10e6933e708	Cognizant Technology Solutions	MICROSOFT DYNAMICS 365 CUSTOMER ENGAGEMENT BUSINESS ANALYST [REMOTE]	Remote in Las Vegas, NV 89044	BA	ENTRY_LEVEL	Estimated $95.1K - $120K a year
