Key	Company	Position	Location	Category	Experience_Level	Salary	Description	Benefits
0a6c240c42677988	FOCUSED HR SOLUTIONS LLC	Business Analyst rec LU	Remote	BA	ENTRY_LEVEL	Estimated $81.8K - $104K a year	 ur direct client has an opening for a Business Analyst rec 57582  This position is 12 months, with option of extension, and is located in Augusta, Maine  WE CAN WORK CORP TO CORP OR W2. . ON SITE ONLY. NO REMOTE WORK OPTION AVAILABLE.  If you are interested, please submit the following:  YOUR CURRENT RESUME  YOUR HOURLY RATE  Our cilentis seeking candidates with experience gathering user requirements and performing data analysis. This position is heavily focused on written documentation, communications with technical and non-technical resources, and defining business needs as part of a 12-month project. This position will be part of a project team within the PMO department.  Role Description: Responsible to work within a project team to understand current state, document current processes, document user requirements, and document process flows.Perform data analysis as needed to support business requirements and process changes.Collaborates with project team to ensure standards and quality checks for gathered requirementsCompleting all PMO required documents and templates Preferred Qualifications Years of Relevant Experience: 7+ yearsPreferred Education: 4-year college degree or equivalentExcellent communication skills. Diplomatic.Knowledge of formal requirements gathering methodologies.Self-starter, able to join a project mid-stream and help bring it to a successful completion.Able to take ownership of a project or work assignment, escalating concerns and issues to the project leadership teamStrong organization and writing skills. Advanced Excel required, SQL experience desired.Extensive experience with Office 2016, including Word, Excel, PowerPoint, Outlook and SkypeFamiliar with SharePoint, which will be used for storing project documentation By replying to this job advertisement, I agree I want to receive additional job advertisements from Focused HR Solutions, including email, phone and mail to the contact information I am submitting. I consent to Focused HR Solutions, its affiliates, third parties and partners processing my personal data for these purposes and as described in the Privacy Policy. I understand that I can withdraw my consent at anytime. Ross FalikThis is a remote position.	[]
6c2e67da840f182e	Edward Jones	Trade Operations Analyst	Hybrid remote in Tempe, AZ 85285	BA	ENTRY_LEVEL	$68,105 - $112,305 a year	You could say we're at the center of the center. Here at Edward Jones the client is our single focus and our relationships with them are the measure of everything we do. And Service and Operations divisions are at the center of it all. We support our clients, branch teams and headquarter associates in providing the best possible experience. Advocate for our more than 7 million clients through regulation communication, fraud protection and managing their investment distributions. Protect their investments by mitigating risk. And innovate new ways of working. Using insights to create solutions for the future - in the here and now. Job Overview Position Schedule: Full-Time  In the Client Services and Operations division at Edward Jones, you'll focus on creating the ideal client and branch experience. From account opening to trade settlement and movement of client cash and securities, to statement production and tax reporting, Operations is involved every step of the way. As the backbone of the branch, your work will support all client transactions and processing through the life cycle of the client relationship. Through strategic thinking and cross-functional collaboration, you'll continuously identify opportunities for operational efficiency and risk mitigation, supporting the firm in its key objectives.  The purpose of the Trade Corrections team is to process mutual fund trade corrections in Select accounts and to all trades in Advisory Solutions and Guided Fund accounts. Select associates are cross trained to process corrections in Equity and Fixed income products in all account types. We have responsibility for principal review, reconciliation issues involving mutual funds, reporting involving mutual fund activity requiring corrections, and tracking gains and losses for mutual funds and Advisory and Guided Fund accounts.  The purpose of the billing and settlement team is to ensure all domestic and foreign trades bill, clear, and settle in a timely manner. We fund daily settlement, work with counterparties to facilitate settlement, ensure content of trade confirmations is accurate, reconcile trade comparison details, and borrow securities, all while ensuring we comply with the many rules and regulations within this space.  What You'll Do  This associate will be a department resource working closely with all Team Leaders for the Trade Corrections and Billing and Settlement teams within Trade Operations for any department and firm efforts. This is a technical and project role including peer coaching to assist other associates working through change lead efforts and technology issues.  Priority focus is on moving forward department process improvement, automation, project tracking, Power BI, dashboards, and stats.  Lead and/or serve as a subject matter expert on large scale firm or business area projects or initiatives that may pose significant regulatory, reputational, system or financial risk. Ensure timely escalation of issues that would create significant risk to the project or initiative deliverables or present risk to the firm or client is critical to the role. Responsibilities include  providing detailed analysis of information along with alternative solutions and present recommendations to business area leaders for process or system improvements.    Implementation of the agreed upon solutions is also required. The ability to understand and interpret complex and diverse information from multiple data sources is paramount. Plan and execute projects, enhancements, and processes, including the launch of new products or product partners and enhancements to existing tools and systems. Serves as a key contact for requirement identification and verification for new products and tools. Lead the testing of enhancements and upgrades with responsibility for the identification, tracking of issues, and implementation of solutions. Develop strong relationships with internal stakeholders and begin to collaborate and build consensus with leaders from multiple divisions. Adopt processes for risk controls (e.g., Privacy, Business Continuity Planning, Record Information Management, Written Supervisory Procedures) and coordinate with departments to complete the applicable requirements. Collaborate with Firm Analytics to leverage data for insights and reporting needed to inform business decisions and communicate results. Performs qualitative and quantitative analysis of complex and confidential data. Broadening and deepening Subject Matter Expertise in assigned product area(s) of emphasis. Share knowledge to help develop other associates. At Edward Jones, we value and respect our associates and their contributions, and we recognize individual efforts through a rewards program that promotes a long-term career, financial security and well-being. Visit our career site to learn more about our total compensation approach, which in addition to base salary, typically includes benefits, bonuses and profit sharing. The salary range for this role is based on national data and actual pay is based on skills, experience, education, and other relevant factors for a potential new associate:  Hiring Minimum: $68105  Hiring Maximum: $112305 Skills/Requirements What Experience You Need:  The ability to thoroughly understand and analyze the issues from multiple stakeholder points of view is necessary to conclude the best possible outcome for clients, branches, product partners/vendors, and the firm. Critical thinking skills and sound judgment are required to know when to seek assistance from a more senior associate, leader, or Partner as potential problems become more complex. There are typically multiple issues and consequences to each resolution. The decisions relate to the expert ability to identify and resolve technical issues or make decisions and to assess the impact of a decision on multiple parties (IS, end users, clients, etc.) Feedback coaching, training, and guiding peer associates. Candidates that live within in a commutable distance from our Tempe, AZ and St. Louis, MO home office locations are expected to work in the office three days per week, with preference for Tuesday through Thursday. What could set you apart:  Background in project management, change management, risk management, business specific technical support, lean six sigma or business analysis. Moderate experience in Power BI and Tableau Series 99 license Awards & Accolades 100 Best Workplaces for Millennials in 2022, published Fortune July 2022, Great Places to Work® data as of March 2022. Compensation provided for using, not obtaining, the rating.    Edward Jones was recognized as one of the Best Workplaces for Millennials by Great Places to Work® and Fortune® magazine. The privately held firm ranked No. 2 overall, in its fourth appearance on the list. 2022 Fortune Best Workplaces for Women, published September 2022, research by Great Places to Work®, data as of August 2021. Compensation provided for using, not obtaining, the rating.    Edward Jones has been named to the 2022 Best Workplaces for Women list by Great Places to Work® and Fortune® magazine, ranking No. 45. 2022 Fortune's 100 Best Companies to Work For, published April 2022, research by Great Place to Work®, data as of August 2021. Compensation provided for using, not obtaining, the rating.    For the 23rd time, Edward Jones has earned a spot on the Fortune 100 Best Companies to Work For® ranking by Great Places to Work® and Fortune® magazine. Edward Jones ranked No. 35 on the prestigious 2022 list. 2022 Best Places to Work For LGBTQ+ Equality, Great Place to Work® in partnership with Human Rights Campaign Foundation, published Equity Magazine January 2022, data as of July 2021. Compensation provided for using, not obtaining, the rating.      Edward Jones scored 100 percent on the Human Rights Campaign Foundation's 2022 Corporate Equality Index (CEI) the nation's foremost benchmarking survey and report measuring corporate policies and practices related to LGBTQ+ workplace equality. The ranking designated Jones as one of the best places to work for LGBTQ+Equality. About Us At Edward Jones, we help clients achieve their serious, long-term financial goals by understanding their needs and implementing tailored solutions. To ensure a personal client experience, we have located our 15,000+ branch offices where our more than 7 million clients live and work.  In a typical branch office, a financial advisor meets with clients and receives branch office support, so they can focus on building deep relationships with clients. Headquarters associates in St. Louis, Tempe and Mississauga provide support and expertise to help U.S. and Canada branch teams deliver an ideal client experience. We continue to grow to meet the needs of long-term individual investors.  Edward Jones does not discriminate on the basis of race, color, gender, religion, national origin, age, disability, sexual orientation, pregnancy, veteran status, genetic information or any other basis prohibited by applicable law.  #LI-HO	['Profit sharing']
23cb7f2c6672ef94	Edward Jones	Trade Operations Analyst	Hybrid remote in St. Louis, MO	BA	ENTRY_LEVEL	$68,105 - $112,305 a year	You could say we're at the center of the center. Here at Edward Jones the client is our single focus and our relationships with them are the measure of everything we do. And Service and Operations divisions are at the center of it all. We support our clients, branch teams and headquarter associates in providing the best possible experience. Advocate for our more than 7 million clients through regulation communication, fraud protection and managing their investment distributions. Protect their investments by mitigating risk. And innovate new ways of working. Using insights to create solutions for the future - in the here and now. Job Overview Position Schedule: Full-Time  In the Client Services and Operations division at Edward Jones, you'll focus on creating the ideal client and branch experience. From account opening to trade settlement and movement of client cash and securities, to statement production and tax reporting, Operations is involved every step of the way. As the backbone of the branch, your work will support all client transactions and processing through the life cycle of the client relationship. Through strategic thinking and cross-functional collaboration, you'll continuously identify opportunities for operational efficiency and risk mitigation, supporting the firm in its key objectives.  The purpose of the Trade Corrections team is to process mutual fund trade corrections in Select accounts and to all trades in Advisory Solutions and Guided Fund accounts. Select associates are cross trained to process corrections in Equity and Fixed income products in all account types. We have responsibility for principal review, reconciliation issues involving mutual funds, reporting involving mutual fund activity requiring corrections, and tracking gains and losses for mutual funds and Advisory and Guided Fund accounts.  The purpose of the billing and settlement team is to ensure all domestic and foreign trades bill, clear, and settle in a timely manner. We fund daily settlement, work with counterparties to facilitate settlement, ensure content of trade confirmations is accurate, reconcile trade comparison details, and borrow securities, all while ensuring we comply with the many rules and regulations within this space.  What You'll Do  This associate will be a department resource working closely with all Team Leaders for the Trade Corrections and Billing and Settlement teams within Trade Operations for any department and firm efforts. This is a technical and project role including peer coaching to assist other associates working through change lead efforts and technology issues.  Priority focus is on moving forward department process improvement, automation, project tracking, Power BI, dashboards, and stats.  Lead and/or serve as a subject matter expert on large scale firm or business area projects or initiatives that may pose significant regulatory, reputational, system or financial risk. Ensure timely escalation of issues that would create significant risk to the project or initiative deliverables or present risk to the firm or client is critical to the role. Responsibilities include  providing detailed analysis of information along with alternative solutions and present recommendations to business area leaders for process or system improvements.    Implementation of the agreed upon solutions is also required. The ability to understand and interpret complex and diverse information from multiple data sources is paramount. Plan and execute projects, enhancements, and processes, including the launch of new products or product partners and enhancements to existing tools and systems. Serves as a key contact for requirement identification and verification for new products and tools. Lead the testing of enhancements and upgrades with responsibility for the identification, tracking of issues, and implementation of solutions. Develop strong relationships with internal stakeholders and begin to collaborate and build consensus with leaders from multiple divisions. Adopt processes for risk controls (e.g., Privacy, Business Continuity Planning, Record Information Management, Written Supervisory Procedures) and coordinate with departments to complete the applicable requirements. Collaborate with Firm Analytics to leverage data for insights and reporting needed to inform business decisions and communicate results. Performs qualitative and quantitative analysis of complex and confidential data. Broadening and deepening Subject Matter Expertise in assigned product area(s) of emphasis. Share knowledge to help develop other associates. At Edward Jones, we value and respect our associates and their contributions, and we recognize individual efforts through a rewards program that promotes a long-term career, financial security and well-being. Visit our career site to learn more about our total compensation approach, which in addition to base salary, typically includes benefits, bonuses and profit sharing. The salary range for this role is based on national data and actual pay is based on skills, experience, education, and other relevant factors for a potential new associate:  Hiring Minimum: $68105  Hiring Maximum: $112305 Skills/Requirements What Experience You Need:  The ability to thoroughly understand and analyze the issues from multiple stakeholder points of view is necessary to conclude the best possible outcome for clients, branches, product partners/vendors, and the firm. Critical thinking skills and sound judgment are required to know when to seek assistance from a more senior associate, leader, or Partner as potential problems become more complex. There are typically multiple issues and consequences to each resolution. The decisions relate to the expert ability to identify and resolve technical issues or make decisions and to assess the impact of a decision on multiple parties (IS, end users, clients, etc.) Feedback coaching, training, and guiding peer associates. Candidates that live within in a commutable distance from our Tempe, AZ and St. Louis, MO home office locations are expected to work in the office three days per week, with preference for Tuesday through Thursday. What could set you apart:  Background in project management, change management, risk management, business specific technical support, lean six sigma or business analysis. Moderate experience in Power BI and Tableau Series 99 license Awards & Accolades 100 Best Workplaces for Millennials in 2022, published Fortune July 2022, Great Places to Work® data as of March 2022. Compensation provided for using, not obtaining, the rating.    Edward Jones was recognized as one of the Best Workplaces for Millennials by Great Places to Work® and Fortune® magazine. The privately held firm ranked No. 2 overall, in its fourth appearance on the list. 2022 Fortune Best Workplaces for Women, published September 2022, research by Great Places to Work®, data as of August 2021. Compensation provided for using, not obtaining, the rating.    Edward Jones has been named to the 2022 Best Workplaces for Women list by Great Places to Work® and Fortune® magazine, ranking No. 45. 2022 Fortune's 100 Best Companies to Work For, published April 2022, research by Great Place to Work®, data as of August 2021. Compensation provided for using, not obtaining, the rating.    For the 23rd time, Edward Jones has earned a spot on the Fortune 100 Best Companies to Work For® ranking by Great Places to Work® and Fortune® magazine. Edward Jones ranked No. 35 on the prestigious 2022 list. 2022 Best Places to Work For LGBTQ+ Equality, Great Place to Work® in partnership with Human Rights Campaign Foundation, published Equity Magazine January 2022, data as of July 2021. Compensation provided for using, not obtaining, the rating.      Edward Jones scored 100 percent on the Human Rights Campaign Foundation's 2022 Corporate Equality Index (CEI) the nation's foremost benchmarking survey and report measuring corporate policies and practices related to LGBTQ+ workplace equality. The ranking designated Jones as one of the best places to work for LGBTQ+Equality. About Us At Edward Jones, we help clients achieve their serious, long-term financial goals by understanding their needs and implementing tailored solutions. To ensure a personal client experience, we have located our 15,000+ branch offices where our more than 7 million clients live and work.  In a typical branch office, a financial advisor meets with clients and receives branch office support, so they can focus on building deep relationships with clients. Headquarters associates in St. Louis, Tempe and Mississauga provide support and expertise to help U.S. and Canada branch teams deliver an ideal client experience. We continue to grow to meet the needs of long-term individual investors.  Edward Jones does not discriminate on the basis of race, color, gender, religion, national origin, age, disability, sexual orientation, pregnancy, veteran status, genetic information or any other basis prohibited by applicable law.  #LI-HO	['Profit sharing']
c038e351c7f2edb2	Broward Health	Business Systems Analyst-Business Application Support	Fort Lauderdale, FL	BA	ENTRY_LEVEL	Estimated $69.1K - $87.6K a year	Broward Health Corporate Spectrum Shift: Shift 1 FTE: 1.000000 Summary: Provides day-to-day business support and defines the scope of project objectives. Conducts or participates in projects and tactical meetings and handles issue tracking and analysis. Ensures adherence to quality standards and reviews deliverables with customers.   Education:    Essential:   Bachelor    Experience:    Essential:   Four Years Credentials:Visit us online at www.BrowardHealth.org or contact Talent Acquisition Broward Health is proud to be an equal opportunity employer. Broward Health prohibits any policy or procedure which results in discrimination on the basis of race, color, national origin, gender, gender identity or gender expression, pregnancy, sexual orientation, religion, age, disability, military status, genetic information or any other characteristic protected under applicable federal or state law.	[]
