Key	Company	Position	Location	Category	Experience_Level	Salary	Description	Benefits
ff1f52454a90c11b	State of Washington	Financial and Business Analyst	Remote in Olympia, WA 98504	BA	ENTRY_LEVEL	$72,552 - $97,596 a year	JOB Based on the compensation range we are advertising, the starting salary offer will be determined based on the successful candidates’ qualifications within the budgeted salary range of $72,552 - $97,596 annually. However, there is ability for longevity growth and progression in salary for the individual once employed.Join us!The Washington State Office of Equity is seeking a courageous and unapologetic champion of equity and anti-racism to advance belonging and justice in Washington state. We desire a colleague who questions what is, to help find solutions for what can be.As the Finance and Business Analyst, you will provide the Office of Equity (Office) expert level financial and business analysis and help to identify and resolve complex business problems. Additionally, you will assist the Office in the development and maintenance of reports and financial tools that are used to track and analyze program budgets, allotments, and program detail plans. The work produced by this position will impact and contribute to the financial health of the Office.By providing your technical assistance and strategic planning for procurements and contract activities, you’ll change procurement culture in government purchasing by helping the Office remove barriers between small, diverse, veteran-owned businesses, and statewide goods and services contracts. Who we are: The Office of Equity promotes equitable access to opportunities, power, and resources across state government to reduce disparities and improve outcomes statewide (RCW 43.06D.002). We believe that Washingtonians are stronger together and that Washington can be a state where everyone, especially those from communities historically marginalized and systematically excluded, have what they need to thrive. We model shared power (“nothing about us without us”) in decision-making by partnering with those who are impacted by our decisions and actions to co-create policies, processes, and practices. We facilitate Washington state’s transformation into a Pro-Equity Anti-Racism (PEAR) ecosystem by developing and implementing the PEAR Plan & Playbook (Executive Order 22-04).Our VisionEveryone in Washington State has full access to the opportunities, power, and resources they need to flourish and achieve their full potential. Our MissionTo promote equitable access to opportunities, power, and resources across state government that reduce disparities and improve outcomes statewide. We ValueAccess: Barrier-free environments so everyone can participate.Belonging: The right to participate in all aspects of society with acceptance, attention, and support from members of the society, providing the same to others.Dignity: We honor the sacred nature of each individual’s personhood.Equity: Acknowledging systemic inequalities by developing, strengthening, and supporting policies and procedures that distribute and prioritize resources to people in social identity groups who have historically been and currently are marginalized to ensure everyone has access to the same opportunities, power, resources, and outcomes to achieve equality.Justice: Treating people fairly. To make right. What love looks like in public (Cornell West).Love: A selfless and giving act of the will. We seek to out-give and out-serve the other.Ubuntu: I am because we are. We are interconnected.  EXAMPLE OF DUTIES How you will contribute to our work: Create, track, analyze, maintain tools and reports for program budgets and details. Develop, monitor, analyze annual/supplemental budget requests vs. actual cost. Create monthly budget reports, review statements for that fiscal month. Collaborate to plan, organize, control and manage contracting and procurement duties. Support contract negotiation both internally and externally. Lead increasing diversity in vendors by partnering w/ diverse organizations. Create and execute strategic outreach and education surrounding procurement opportunities with the state.  SUPPLEMENTAL INFORMATION Application ProcessHow to Apply Interested? We would love to hear from you. Click “Apply” at the top of this page to start your application (you can save the application and come back to it, if needed). Please include the following: A letter of interest that describes the steps you’ve personally taken (in or outside of work) to push for racial and social equity (attached).A current resume that details your applicable experience and education (attached).Three professional references with current telephone numbers and email addresses (entered in application). We will directly contact the top candidates to interview for this position. Because we base our selection on the information you provide, it is in your best interest to identify the knowledge, skills, and abilities that address the required and desirable qualifications we described above. Questions? For questions about this recruitment or to request reasonable accommodation in the application process, please email Culture and Belonging Administrator, Zsatasia Green - Zsatasia.green@equity.wa.gov. For TTY service, please call the Washington Relay Service at 7-1-1 or 1-800-833-6388. The Office of Equity is an equal opportunity employer. We work to create a workplace environment that honors and respects the sacred nature of each individual’s personhood. Racial and ethnic members of the global majority, women, persons with a disability, persons over 40 years of age, and Vietnam-era or veterans who are disabled are encouraged to apply. If you need accommodations, help in the application process, or wish to receive this job announcement in an alternative format, please call 360-725-0158 or dial 711 to reach the Telecommunications Device for the Deaf system. Special Note: This position is exempt from civil service rules.For more information, please see WAC 357-19-195.	[]
6fc112a7cd0e9242	Reynolds and Reynolds	Entry Level Business Analyst	Dayton, OH 45430	BA	ENTRY_LEVEL	Estimated $56.6K - $71.7K a year	An Entry Level Business Analyst will serve as the liaison between the end-user community and the technical development team. In this role, you must be able to communicate complex ideas and timelines in a clear, concise manner across functional and technical departments. A successful Analyst will work closely with business users, subject matter experts, and technical resources to identify business needs, define projects, and manage the development effort to completion. You will also develop testing, documentation, and data analysis of your project as needed. Following the project completion, you will also be responsible for verifying the adoption follow-up after implementation and managing long term relationships with end-users. For an inside look at the Business Analyst role, check out this associate's story:  http://life.reyrey.com/2018/10/22/my-reynolds-success-story-ben/ #LI-DNI Requirements: Bachelor's degree, Boot camp, or equivalent experience preferred Strong communication skills (verbal and written) Have strong attention to detail, accuracy, and follow-through Experience in Software Development a plus Benefits: Our associates receive medical, dental, vision, and life insurance. We also offer company contributions to your HSA, 6% match on 401(k), and a work/life balance with paid time off. At our Dayton office, you can take advantage of our great training programs and facility amenities, including onsite dining, onsite medical center, and our fitness center. We also offer a wide variety of sports and social leagues to participate in after work, along with volunteering initiatives through our Associate Foundation. Reynolds and Reynolds promotes a healthy lifestyle by providing a non-smoking environment. Reynolds and Reynolds encourages applicants of all ages and experience to apply, as we do not discriminate on the basis of age.	['401(k)', '401(k) 6% Match', '401(k) matching', 'Dental insurance', 'Health insurance', 'Health savings account', 'Life insurance']
8634cb7860b4fdb4	First Horizon Bank	Jr. IT BUSINESS ANALYST	Lafayette, LA 70501	BA	ENTRY_LEVEL	Estimated $58.2K - $73.7K a year	About Us  First Horizon Corp. (NYSE: FHN), with $89.1 billion in assets as of December 31, 2021, is a leading regional financial services company, dedicated to helping our clients, communities and associates unlock their full potential with capital and counsel. Headquartered in Memphis, TN, the banking subsidiary First Horizon Bank operates in 12 states across the southern U.S. The Company and its subsidiaries offer commercial, private banking, consumer, small business, wealth and trust management, retail brokerage, capital markets, fixed income, mortgage, and title insurance services. First Horizon has been recognized as one of the nation's best employers by Fortune and Forbes magazines and a Top 10 Most Reputable U.S. Bank.The Customer Solution representative will be the escalation point to solve complex problems that are reported by customers and regulatory agencies and to communicate the progress of the solution to the reporting employee, regulatory agencies, and/or affected customer.SUMMARY The Business Analyst is responsible for supporting the Technology Business Office with technology project oversight, KPI reporting, technology budgeting and forecasting, technology process documentation, and other ad hoc projects. ESSENTIAL DUTIES AND RESPONSIBILITIESAssists in the oversight of technology projects through the life cycle.Assists in financial and resource allocation budget for technology projects.Gathers data for technology KPIs and prepares reporting for stakeholders.Liaisons with the Finance Department to facilitate periodic forecast and budget cycles for Technology.Participates in ad hoc projects as required.All other duties as assigned.SUPERVISORY RESPONSIBILITIES No supervisory responsibilities COMPLIANCE Ability to comprehend and adhere to federal and state banking regulations, company policies and procedures, and successfully participate in regulatory and company training requirements via multiple and variable delivery methods. QUALIFICATIONS To perform this job successfully, an individual must be able to perform each essential duty satisfactorily. Additionally, the qualifications listed below are representative of the knowledge, skills, and/or abilities required in this position:Bachelor (4-year college) degree in Business, Finance, or similar discipline.1-2 years of experience or equivalent combination of education and experience.Strong presentation (oral and written communication) skills with ability to effectively communicate to senior executives.Experience with MS Office – Excel, PowerPoint, Outlook.Team orientation and excellent interpersonal skills.Strong organizational skills with the ability to manage multiple tasks and meet deadlines.Benefit HighlightsMedical with wellness incentives, dental, and visionHSA with company matchMaternity and parental leaveTuition reimbursementMentor program401(k) with 6% match More   - FirstHorizon.com/First-Horizon-National-Corporation/Careers/Our-BenefitsFollow Us  Facebook - facebook.com/FirstHorizonBank Twitter - twitter.com/FirstHorizonBnk LinkedIn - linkedin.com/company/first-horizon-bank Instagram - instagram.com/first_horizon YouTube - youtube.com/channel/UCEVs5OMj-b0H9Dr5Q209_-Q Corporate Diversity Commitment: We remain committed to creating a more equitable society, and that starts with our associates, our clients, and the communities we serve. We do this by elevating equity, providing capital and counsel, and committing to excellence in everything we do. Equal Opportunity Employer/Protected Veterans/Individuals with Disabilities The contractor will not discharge or in any other manner discriminate against employees or applicants because they have inquired about, discussed, or disclosed their own pay or the pay of another employee or applicant. However, employees who have access to the compensation information of other employees or applicants as a part of their essential job functions cannot disclose the pay of other employees or applicants to individuals who do not otherwise have access to compensation information, unless the disclosure is (a) in response to a formal complaint or charge, (b) in furtherance of an investigation, proceeding, hearing, or action, including an investigation conducted by the employer, or (c) consistent with the contractor’s legal duty to furnish information. 41 CFR 60-1.35(c)	['401(k)', '401(k) 6% Match', '401(k) matching', 'Health insurance', 'Health savings account', 'Parental leave', 'Tuition reimbursement']
e4ffed410d20abba	California Highway Patrol	ASSOCIATE BUSINESS MANAGEMENT ANALYST	Sacramento County, CA	BA	ENTRY_LEVEL	$5,518 - $6,907 a month	Job Description and Duties             The Associate Governmental Program Analyst certification list is being utilized to recruit for this position. Applicants with Associate Governmental Program Analyst certification list eligibility MUST also meet the minimum qualifications for the Associate Business Management Analyst classification in order to be eligible for an appointment.             Support Facilities Section’s mission to maintain all departmental structures and property, ensuring compliance with all state and federal codes and regulations to provide the highest level of safety, service and security to our employees and the motoring public. Under the direction of a Staff Services Manager I, the ABMA is responsible for independently managing the facility responsibilities of offices/buildings within an assigned geographic location. Develop and submit complete contract packages, including justifications, specific scopes of work, and associated required documents. Process invoices, attend bid walks, pre-construction meetings, on-going construction meetings, project development, over-site and tracking of special repair projects, and deferred and recurring maintenance. Research project cost, providing estimates and quotes, written responses or presentations requiring strong written and verbal skills. Completion of bill analysis and Merit Award Suggestion responses as needed.             You will find additional information about the job in the Duty Statement.Working ConditionsWork hours Monday-Friday 8-5. Travel and overtime may be required.  This position is designated under the Conflict of Interest Code. The position is responsible for making or participating in the making of governmental decisions that may potentially have a material effect on personal financial interests. The appointee is required to complete Form 700 within 30 days of appointment. Failure to comply with the Conflict of Interest Code requirements may void the appointment. Job Code #:               JC-406768               Position #(s):                388-078-4742-017               Working Title:ABMAClassification:               ASSOCIATE BUSINESS MANAGEMENT ANALYST                                $5,518.00 - $6,907.00 A                Work Location:               Sacramento County               Telework:               In Office               Job Type:               Permanent, Full Time               Department Information             601 N 7th Street, Building B              Sacramento, CA 95811              The mission of the California Highway Patrol is to provide the highest level of Safety, Service, and Security. The California Highway Patrol offers challenging and exciting careers in the field of law enforcement. If you are interested in diversity, challenges, and opportunities, the CHP invites you to apply to become a part of our professional organization. We remain competitive and current with training and technology, keeping the citizens of California safe. We have many employment opportunities, and we invite you to look into the California Highway Patrol for your future.             Department Website: https://www.chp.ca.gov Special RequirementsPossession of Minimum Qualifications will be verified prior to appointment. To satisfy the minimum qualification requirement with education, you must include your unofficial transcript(s)/diploma for initial review. Original diploma or official, sealed transcripts will be required prior to the start date. Applicants with foreign transcript(s)/degree(s) must provide a third-party transcript/degree credential evaluation that indicates the number of units to which the foreign coursework is equivalent.Application InstructionsCompleted applications and all required documents must be received or postmarked by the Final Filing Date in order to be considered. Dates printed on Mobile Bar Codes, such as the Quick Response (QR) Codes available at the USPS, are not considered Postmark dates for the purpose of determining timely filing of an application. Final Filing Date: 12/20/2023              Who May Apply              Individuals who are currently in the classification, eligible for lateral transfer, eligible for reinstatement, have list eligibility, are in the process of obtaining list eligibility, or have SROA and/or Surplus eligibility (please attach your letter, if available). SROA and Surplus candidates are given priority; therefore, individuals with other eligibility may be considered in the event no SROA or Surplus candidates apply. Individuals who are eligible for a Training and Development assignment may also be considered for this position(s).                Applications will be screened and only the most qualified applicants will be selected to move forward in the selection process. Applicants must meet the Minimum Qualifications stated in the Classification Specification(s).              How To Apply              Complete Application Packages (including your Examination/Employment Application (STD 678) and applicable or required documents) must be submitted to apply for this Job Posting. Application Packages may be submitted electronically through your CalCareer Account at www.CalCareers.ca.gov. When submitting your application in hard copy, a completed copy of the Application Package listing must be included. If you choose to not apply electronically, a hard copy application package may be submitted through an alternative method listed below:              Address for Mailing Application PackagesYou may submit your application and any applicable or required documents to:                  California Highway Patrol                                    Attn: Marissa Cruz-Hernandez                                    097/Classification & Hiring                                    P.O. Box 942898                                    Sacramento, CA 94298-0001                  Address for Drop-Off Application PackagesYou may drop off your application and any applicable or required documents at:                   California Highway Patrol                                      Classification and Hiring                                      601 North 7th Street                                      Sacramento, CA 95811                                      08:00 AM - 05:00 PM                   Required Application Package DocumentsThe following items are required to be submitted with your application. Applicants who do not submit the required items timely may not be considered for this job: Current version of the State Examination/Employment Application STD Form 678 (when not applying electronically), or the Electronic State Employment Application through your Applicant Account at www.CalCareers.ca.gov. All Experience and Education relating to the Minimum Qualifications listed on the Classification Specification should be included to demonstrate how you meet the Minimum Qualifications for the position.Resume is optional. It may be included, but is not required.Criminal Record Supplemental QuestionnaireStatement of Qualifications - The SOQ is to be typed (8-1/2 x 11 size paper), Arial 12 pt. font and margins are to be no less than 1-inch, no more than one question per page. Responses are not to be combined, each question shall be clearly identified and answered independently.  1) Describe how your education, work experience, and/or training make you a good candidate for the position of ABMA at Facilities Section.  2) Provide a detailed description of your experience performing analytical work, research, and making recommendations to your supervisor.  3) Describe your ability to analyze complex facility related issues, developing and/or evaluating alternatives, and recommending solutions. Applicants requiring reasonable accommodations for the hiring interview process must request the necessary accommodations if scheduled for a hiring interview. The request should be made at the time of contact to schedule the interview. Questions regarding reasonable accommodations may be directed to the EEO contact listed on this job posting.            Desirable Qualifications           In addition to evaluating each candidate's relative ability, as demonstrated by quality and breadth of experience, the following factors will provide the basis for competitively evaluating each candidate:                      Knowledge and experience in building maintenance, building repair, purchasing, and contracts; exceptional interpersonal and communication skills; excellent time management skills; strong organization, self-starter; ability and willingness to work in a fast-paced, team environment; excellent attendance; punctuality; and ability for attention to detail.           Benefits           Close to Downtown Sacramento. A secure campus features; on-site ATM and Bistro, close to light rail, and free parking.            Benefit information can be found on the CalHR website and the CalPERS website.           Contact InformationThe Human Resources Contact is available to answer questions regarding the application process. The Hiring Unit Contact is available to answer questions regarding the position. Department Website: https://www.chp.ca.gov Human Resources Contact:  Marissa Cruz-Hernandez (916) 843-3788 Marissa.Cruz-Hernandez@chp.ca.gov Hiring Unit Contact:  Holly Schoer (916) 843-3809 holly.schoer@chp.ca.gov Please direct requests for Reasonable Accommodations to the interview scheduler at the time the interview is being scheduled. You may direct any additional questions regarding Reasonable Accommodations or Equal Employment Opportunity for this position(s) to the Department's EEO Office. EEO Contact: Office of Equal Employment Opportunity             (916) 843-3190             oeeo@chp.ca.gov            California Relay Service: 1-800-735-2929 (TTY), 1-800-735-2922 (Voice) TTY is a Telecommunications Device for the Deaf, and is reachable only from phones equipped with a TTY Device. Additional Application Submission RequirementsInterested individuals shall submit a Criminal Record Supplemental Questionnaire and a Statement of Qualifications with their STD. 678 Employment Application. Hard copy applications must also include the classification title, job control number (JC-406768) and/or position number 388-078-4742-017 on the application. It is required to submit work/employment experience, dates, hours worked, supervisor names and supervisor phone numbers on the application in descending order, starting with your current job. Resumes or other documents cannot substitute a state application. Applicants who fail to submit a completed state application may not be considered. Do not include any confidential information on any documents you submit for this job vacancy, such as your state application, resume, or educational transcripts. Confidential information that should be excluded or removed from these documents includes, but is not limited to, the Equal Employment Opportunity page, your Social Security Number, birth date, driver’s license number, examination results, LEAP status, marital status, and age. The job application packet checklist is not required to apply for this position. Failure to follow these instructions may result in your application not being considered for this position. Although the intent is to fill this vacancy as soon as possible, the exact duration of the selection process can vary and is unknown at this time.          Other           Please note: To obtain list eligibility, you will need to take and pass an examination for the classification to establish list eligibility prior to a job offer. Please visit the link below to search for an examination. https://www.calcareers.ca.gov/CalHRPublic/Search/ExamSearch.aspx          Equal Opportunity EmployerThe State of California is an equal opportunity employer to all, regardless of age, ancestry, color, disability (mental and physical), exercising the right to family care and medical leave, gender, gender expression, gender identity, genetic information, marital status, medical condition, military or veteran status, national origin, political affiliation, race, religious creed, sex (includes pregnancy, childbirth, breastfeeding and related medical conditions), and sexual orientation. It is an objective of the State of California to achieve a drug-free work place. Any applicant for state employment will be expected to behave in accordance with this objective because the use of illegal drugs is inconsistent with the law of the State, the rules governing Civil Service, and the special trust placed in public servants.	['Commuter assistance', 'Free parking']
